Index	eco	name	pgn
1668	C22	Center Game: l'Hermet Variation	1. e4 e5 2. d4 exd4 3. Qxd4 Nc6 4. Qe3 f5
1669	C23	Bishop's Opening	1. e4 e5 2. Bc4
1670	C23	Bishop's Opening: Anderssen Gambit	1. e4 e5 2. Bc4 b5 3. Bxb5 c6
1671	C23	Bishop's Opening: Boi Variation	1. e4 e5 2. Bc4 Bc5
1672	C23	Bishop's Opening: Calabrese Countergambit	1. e4 e5 2. Bc4 f5
1673	C23	Bishop's Opening: Calabrese Countergambit, Jaenisch Variation	1. e4 e5 2. Bc4 f5 3. d3
1674	C23	Bishop's Opening: Four Pawns Gambit	1. e4 e5 2. Bc4 Bc5 3. b4 Bxb4 4. f4 exf4 5. Nf3 Be7 6. d4 Bh4+ 7. g3 fxg3 8. O-O gxh2+ 9. Kh1
1675	C23	Bishop's Opening: Khan Gambit	1. e4 e5 2. Bc4 d5
1676	C23	Bishop's Opening: Lewis Countergambit	1. e4 e5 2. Bc4 Bc5 3. c3 d5
1677	C23	Bishop's Opening: Lewis Countergambit	1. e4 e5 2. Bc4 Bc5 3. c3 d5 4. Bxd5 Nf6
1678	C23	Bishop's Opening: Lewis Countergambit, Walker Variation	1. e4 e5 2. Bc4 Bc5 3. c3 d5 4. Bxd5 Nf6 5. d4
1679	C23	Bishop's Opening: Lewis Gambit	1. e4 e5 2. Bc4 Bc5 3. d4
1680	C23	Bishop's Opening: Lisitsyn Variation	1. e4 e5 2. Bc4 c6 3. d4 d5 4. exd5 cxd5 5. Bb5+ Bd7 6. Bxd7+ Nxd7 7. dxe5 Nxe5 8. Ne2
1681	C23	Bishop's Opening: Lopez Gambit	1. e4 e5 2. Bc4 Bc5 3. Qe2 Nc6 4. c3 Nf6 5. f4
1682	C23	Bishop's Opening: Lopez Variation	1. e4 e5 2. Bc4 Bc5 3. Qe2
1683	C23	Bishop's Opening: Lopez Variation, Lopez Gambit	1. e4 e5 2. Bc4 Bc5 3. Qe2 Nf6 4. f4
1684	C23	Bishop's Opening: McDonnell Gambit	1. e4 e5 2. Bc4 Bc5 3. b4
1685	C23	Bishop's Opening: McDonnell Gambit, La Bourdonnais-Denker Gambit	1. e4 e5 2. Bc4 Bc5 3. b4 Bxb4 4. c3
1686	C23	Bishop's Opening: McDonnell Gambit, McDonnell Double Gambit	1. e4 e5 2. Bc4 Bc5 3. b4 Bxb4 4. f4
1687	C23	Bishop's Opening: Philidor Counterattack	1. e4 e5 2. Bc4 c6
1688	C23	Bishop's Opening: Philidor Variation	1. e4 e5 2. Bc4 Bc5 3. c3
1689	C23	Bishop's Opening: Pratt Variation	1. e4 e5 2. Bc4 Bc5 3. c3 Nf6 4. d4 exd4 5. e5 d5 6. exf6 dxc4 7. Qh5 O-O
1690	C23	Bishop's Opening: Stein Gambit	1. e4 e5 2. Bc4 Bc5 3. f4
1691	C23	Bishop's Opening: Thorold Gambit	1. e4 e5 2. Bc4 b5 3. Bxb5 f5
1692	C23	Bishop's Opening: del Rio Variation	1. e4 e5 2. Bc4 Bc5 3. c3 Qg5
1693	C24	Bishop's Opening: Berlin Defense	1. e4 e5 2. Bc4 Nf6
1694	C24	Bishop's Opening: Berlin Defense, Greco Gambit	1. e4 e5 2. Bc4 Nf6 3. f4
1695	C24	Bishop's Opening: Kitchener Folly	1. e4 e5 2. Bc4 Nf6 3. d3 Be7 4. Nf3 O-O
1696	C24	Bishop's Opening: Krejcik Gambit	1. e4 e5 2. Bc4 Nf6 3. f3 Bc5 4. Ne2 Nc6 5. b4
1697	C24	Bishop's Opening: Pachman Gambit	1. e4 e5 2. Bc4 Nf6 3. Ne2 Nxe4 4. Nec3
1698	C24	Bishop's Opening: Ponziani Gambit	1. e4 e5 2. Bc4 Nf6 3. d4
1699	C24	Bishop's Opening: Urusov Gambit, Panov Variation	1. e4 e5 2. Bc4 Nf6 3. d4 exd4 4. Nf3 d5 5. exd5 Bb4+ 6. c3 Qe7+
1700	C24	Bishop's Opening: Vienna Hybrid	1. e4 e5 2. Bc4 Nf6 3. d3 Nc6 4. Nc3
1701	C24	Bishop's Opening: Warsaw Gambit	1. e4 e5 2. Bc4 Nf6 3. d4 exd4 4. c3
1702	C25	Vienna Gambit, with Max Lange Defense	1. e4 e5 2. Nc3 Nc6 3. f4
1703	C25	Vienna Gambit, with Max Lange Defense: Cunningham Defense	1. e4 e5 2. Nc3 Nc6 3. f4 exf4 4. Nf3 Be7
1704	C25	Vienna Gambit, with Max Lange Defense: Hamppe-Allgaier Gambit	1. e4 e5 2. Nc3 Nc6 3. f4 exf4 4. Nf3 g5 5. h4 g4 6. Ng5
1705	C25	Vienna Gambit, with Max Lange Defense: Hamppe-Allgaier Gambit, Alapin Variation	1. e4 e5 2. Nc3 Nc6 3. f4 exf4 4. Nf3 g5 5. h4 g4 6. Ng5 d6
1706	C25	Vienna Gambit, with Max Lange Defense: Hamppe-Allgaier Gambit, Thorold Variation	1. e4 e5 2. f4 exf4 3. Nf3 Nc6 4. Nc3 g5 5. h4 g4 6. Ng5 h6 7. Nxf7 Kxf7 8. d4
1707	C25	Vienna Gambit, with Max Lange Defense: Hamppe-Muzio Gambit	1. e4 e5 2. Nc3 Nc6 3. f4 exf4 4. Nf3 g5 5. Bc4 g4 6. O-O gxf3
1708	C25	Vienna Gambit, with Max Lange Defense: Knight Variation	1. e4 e5 2. Nc3 Nc6 3. f4 exf4 4. Nf3
1709	C25	Vienna Gambit, with Max Lange Defense: Pierce Gambit	1. e4 e5 2. Nc3 Nc6 3. f4 exf4 4. Nf3 g5 5. d4
1710	C25	Vienna Gambit, with Max Lange Defense: Quelle Gambit	1. e4 e5 2. Nc3 Nc6 3. f4 Bc5 4. fxe5 d6
1711	C25	Vienna Gambit, with Max Lange Defense: Steinitz Gambit	1. e4 e5 2. Nc3 Nc6 3. f4 exf4 4. d4
1712	C25	Vienna Gambit, with Max Lange Defense: Steinitz Gambit, Fraser-Minckwitz Defense	1. e4 e5 2. Nc3 Nc6 3. f4 exf4 4. d4 Qh4+ 5. Ke2 b6
1713	C25	Vienna Gambit, with Max Lange Defense: Steinitz Gambit, Main Line	1. e4 e5 2. Nc3 Nc6 3. f4 exf4 4. d4 Qh4+ 5. Ke2
1714	C25	Vienna Gambit, with Max Lange Defense: Steinitz Gambit, Paulsen Defense	1. e4 e5 2. Nc3 Nc6 3. f4 exf4 4. d4 Qh4+ 5. Ke2 d6
1715	C25	Vienna Gambit, with Max Lange Defense: Steinitz Gambit, Sörensen Defense	1. e4 e5 2. Nc3 Nc6 3. f4 exf4 4. d4 Qh4+ 5. Ke2 g5
1716	C25	Vienna Gambit, with Max Lange Defense: Steinitz Gambit, Zukertort Defense	1. e4 e5 2. Nc3 Nc6 3. f4 exf4 4. d4 Qh4+ 5. Ke2 d5
1717	C25	Vienna Game	1. e4 e5 2. Nc3
1718	C25	Vienna Game: Anderssen Defense	1. e4 e5 2. Nc3 Bc5
1719	C25	Vienna Game: Fyfe Gambit	1. e4 e5 2. Nc3 Nc6 3. d4
1720	C25	Vienna Game: Giraffe Attack	1. e4 e5 2. Nc3 Bc5 3. Qg4
1721	C25	Vienna Game: Hamppe-Meitner Variation	1. e4 e5 2. Nc3 Bc5 3. Na4
1722	C25	Vienna Game: Hamppe-Muzio Gambit	1. e4 e5 2. Nc3 Nc6 3. f4 exf4 4. Nf3 g5 5. Bc4 g4 6. O-O
1723	C25	Vienna Game: Hamppe-Muzio, Dubois Variation	1. e4 e5 2. Nc3 Nc6 3. f4 exf4 4. Nf3 g5 5. Bc4 g4 6. O-O gxf3 7. Qxf3 Ne5 8. Qxf4 Qf6
1724	C25	Vienna Game: Max Lange Defense	1. e4 e5 2. Nc3 Nc6
1725	C25	Vienna Game: Omaha Gambit	1. e4 e5 2. Nc3 d6 3. f4
1726	C25	Vienna Game: Paulsen Variation	1. e4 e5 2. Nc3 Nc6 3. g3
1727	C25	Vienna Game: Paulsen Variation	1. e4 e5 2. Nc3 Nc6 3. g3 Nf6 4. Bg2 Bc5 5. Nge2 d5
1728	C25	Vienna Game: Paulsen Variation, Mariotti Gambit	1. e4 e5 2. Nc3 Nc6 3. g3 Bc5 4. Bg2 h5 5. Nf3 h4
1729	C25	Vienna Game: Philidor Countergambit	1. e4 e5 2. Nc3 Nc6 3. d4 f5
1730	C25	Vienna Game: Pierce Gambit, Rushmere Attack	1. e4 e5 2. Nc3 Nc6 3. f4 exf4 4. Nf3 g5 5. d4 g4 6. Bc4 gxf3 7. O-O d5 8. exd5 Bg4 9. dxc6
1731	C25	Vienna Game: Stanley Variation, Meitner-Mieses Gambit	1. e4 e5 2. Nc3 Nc6 3. Bc4 Bc5 4. Qg4 Qf6 5. Nd5
1732	C25	Vienna Game: Zhuravlev Countergambit	1. e4 e5 2. Nc3 Bb4 3. Qg4 Nf6
1733	C26	Bishop's Opening: Horwitz Gambit	1. e4 e5 2. Bc4 Nf6 3. Nc3 b5
1734	C26	Bishop's Opening: Vienna Hybrid, Spielmann Attack	1. e4 e5 2. Nc3 Nf6 3. Bc4 Bc5 4. d3
1735	C26	Vienna Game: Falkbeer Variation	1. e4 e5 2. Nc3 Nf6
1736	C26	Vienna Game: Mengarini Variation	1. e4 e5 2. Nc3 Nf6 3. a3
1737	C26	Vienna Game: Mieses Variation	1. e4 e5 2. Nc3 Nf6 3. g3
1738	C26	Vienna Game: Mieses Variation, Erben Gambit	1. e4 e5 2. Nc3 Nf6 3. g3 d5 4. exd5 c6
1739	C26	Vienna Game: Paulsen Variation, Pollock Gambit	1. e4 e5 2. Nc3 Nf6 3. g3 Bc5 4. Bg2 Nc6 5. Nge2 d5 6. exd5
1740	C26	Vienna Game: Stanley Variation	1. e4 e5 2. Nc3 Nf6 3. Bc4
1741	C26	Vienna Game: Stanley Variation, Eifel Gambit	1. e4 e5 2. Nc3 Nf6 3. Bc4 Bc5 4. Nge2 b5
1742	C26	Vienna Game: Stanley Variation, Reversed Spanish	1. e4 e5 2. Nc3 Nf6 3. Bc4 Bb4
1743	C27	Bishop's Opening: Boden-Kieseritzky Gambit	1. e4 e5 2. Nf3 Nf6 3. Bc4 Nxe4 4. Nc3
1744	C27	Bishop's Opening: Boden-Kieseritzky Gambit, Lichtenhein Defense	1. e4 e5 2. Nf3 Nf6 3. Bc4 Nxe4 4. Nc3 d5
1745	C27	Vienna Game: Adams' Gambit	1. e4 e5 2. Nc3 Nf6 3. Bc4 Nxe4 4. Qh5 Nd6 5. Bb3 Nc6 6. d4
1746	C27	Vienna Game: Frankenstein-Dracula Variation	1. e4 e5 2. Nc3 Nf6 3. Bc4 Nxe4
1747	C27	Vienna Game: Stanley Variation, Alekhine Variation	1. e4 e5 2. Nc3 Nf6 3. Bc4 Nxe4 4. Qh5 Nd6 5. Bb3 Be7 6. Nf3 Nc6 7. Nxe5
1748	C27	Vienna Game: Stanley Variation, Frankenstein-Dracula Variation	1. e4 e5 2. Nc3 Nf6 3. Bc4 Nxe4 4. Qh5 Nd6 5. Bb3 Nc6 6. Nb5 g6 7. Qf3 f5 8. Qd5 Qe7 9. Nxc7+ Kd8 10. Nxa8 b6
1749	C27	Vienna Game: Stanley Variation, Monster Declined	1. e4 e5 2. Nc3 Nf6 3. Bc4 Nxe4 4. Qh5 Nd6 5. Bb3 Be7
1750	C28	Bishop's Opening: Vienna Hybrid, Hromádka Variation	1. e4 e5 2. Nc3 Nc6 3. Bc4 Nf6 4. d3 Bb4 5. Ne2
1751	C28	Vienna Game: Stanley Variation, Bronstein Gambit	1. e4 e5 2. Nc3 Nc6 3. Bc4 Nf6 4. f4 Nxe4 5. Nf3
1752	C28	Vienna Game: Stanley Variation, Three Knights Variation	1. e4 e5 2. Nc3 Nc6 3. Bc4 Nf6
1753	C29	Vienna Game: Heyde Variation	1. e4 e5 2. Nc3 Nf6 3. f4 d5 4. fxe5 Nxe4 5. Qf3 f5 6. d4
1754	C29	Vienna Game: Vienna Gambit	1. e4 e5 2. Nc3 Nf6 3. f4
1755	C29	Vienna Game: Vienna Gambit, Bardeleben Variation	1. e4 e5 2. Nc3 Nf6 3. f4 d5 4. fxe5 Nxe4 5. Qf3 f5
1756	C29	Vienna Game: Vienna Gambit, Breyer Variation	1. e4 e5 2. Nc3 Nf6 3. f4 d5 4. fxe5 Nxe4 5. Nf3 Be7
1757	C29	Vienna Game: Vienna Gambit, Kaufmann Variation	1. e4 e5 2. Nc3 Nf6 3. f4 d5 4. fxe5 Nxe4 5. Nf3 Bg4 6. Qe2
1758	C29	Vienna Game: Vienna Gambit, Main Line	1. e4 e5 2. Nc3 Nf6 3. f4 d5
1759	C29	Vienna Game: Vienna Gambit, Modern Variation	1. e4 e5 2. Nc3 Nf6 3. f4 d5 4. fxe5 Nxe4 5. d3
1760	C29	Vienna Game: Vienna Gambit, Paulsen Attack	1. e4 e5 2. Nc3 Nf6 3. f4 d5 4. fxe5 Nxe4 5. Qf3
1761	C29	Vienna Game: Vienna Gambit, Steinitz Variation	1. e4 e5 2. Nc3 Nf6 3. f4 d5 4. d3
1762	C29	Vienna Game: Vienna Gambit, Wurzburger Trap	1. e4 e5 2. Nc3 Nf6 3. f4 d5 4. fxe5 Nxe4 5. d3 Qh4+ 6. g3 Nxg3 7. Nf3 Qh5 8. Nxd5
1763	C30	King's Gambit	1. e4 e5 2. f4
1764	C30	King's Gambit Declined: Classical Variation	1. e4 e5 2. f4 Bc5
1765	C30	King's Gambit Declined: Classical Variation	1. e4 e5 2. f4 Bc5 3. Nf3 d6 4. c3
1766	C30	King's Gambit Declined: Classical Variation, Euwe Attack	1. e4 e5 2. f4 Bc5 3. Nf3 d6 4. c3 Bg4 5. fxe5 dxe5 6. Qa4+
1767	C30	King's Gambit Declined: Classical Variation, Rotlewi Countergambit	1. e4 e5 2. f4 Bc5 3. Nf3 d6 4. b4
1768	C30	King's Gambit Declined: Classical Variation, Rubinstein Countergambit	1. e4 e5 2. f4 Bc5 3. Nf3 d6 4. c3 f5
1769	C30	King's Gambit Declined: Classical, Hanham Variation	1. e4 e5 2. f4 Bc5 3. Nf3 d6 4. Nc3 Nd7
1770	C30	King's Gambit Declined: Classical, Réti Variation	1. e4 e5 2. f4 Bc5 3. Nf3 d6 4. c3 f5 5. fxe5 dxe5 6. d4 exd4 7. Bc4
1771	C30	King's Gambit Declined: Classical, Soldatenkov Variation	1. e4 e5 2. f4 Bc5 3. Nf3 d6 4. fxe5
1772	C30	King's Gambit Declined: Classical, Svenonius Variation	1. e4 e5 2. Bc4 Nc6 3. Nc3 Nf6 4. d3 Bc5 5. f4 d6 6. Nf3 Bg4 7. h3 Bxf3 8. Qxf3 exf4
1773	C30	King's Gambit Declined: Hobbs-Zilbermints Gambit	1. e4 e5 2. f4 Nc6 3. Nf3 g5 4. fxg5 h6
1774	C30	King's Gambit Declined: Keene Defense	1. e4 e5 2. f4 Qh4+ 3. g3 Qe7
1775	C30	King's Gambit Declined: Keene's Defense	1. e4 e5 2. f4 Qh4+
1776	C30	King's Gambit Declined: Keene's Defense	1. e4 e5 2. f4 Qh4+ 3. g3
1777	C30	King's Gambit Declined: Mafia Defense	1. e4 c5 2. f4 e5
1778	C30	King's Gambit Declined: Miles Defense	1. e4 e5 2. f4 Nc6 3. Nf3 f5
1779	C30	King's Gambit Declined: Norwalde Variation	1. e4 e5 2. f4 Qf6
1780	C30	King's Gambit Declined: Norwalde Variation, Bücker Gambit	1. e4 e5 2. f4 Qf6 3. Nc3 Qxf4 4. Nf3 Bb4 5. Bc4
1781	C30	King's Gambit Declined: Norwalde Variation, Schubert Variation	1. e4 e5 2. f4 Qf6 3. Nc3 Qxf4 4. d4
1782	C30	King's Gambit Declined: Panteldakis Countergambit	1. e4 e5 2. f4 f5
1783	C30	King's Gambit Declined: Panteldakis Countergambit, Greco Variation	1. e4 e5 2. f4 f5 3. exf5 Qh4+
1784	C30	King's Gambit Declined: Panteldakis Countergambit, Pawn Sacrifice Line	1. e4 e5 2. f4 f5 3. exf5 exf4 4. Qh5+ g6 5. fxg6 Qe7+ 6. Kd1
1785	C30	King's Gambit Declined: Panteldakis Countergambit, Schiller's Defense	1. e4 e5 2. f4 f5 3. exf5 Bc5
1786	C30	King's Gambit Declined: Panteldakis Countergambit, Shirazi Line	1. e4 e5 2. f4 f5 3. exf5 exf4 4. Qh5+ Ke7
1787	C30	King's Gambit Declined: Panteldakis Countergambit, Symmetrical Variation	1. e4 e5 2. f4 f5 3. exf5 exf4 4. Nf3 d5 5. d4 Bd6 6. Bd3
1788	C30	King's Gambit Declined: Petrov's Defense	1. e4 e5 2. f4 Nf6
1789	C30	King's Gambit Declined: Queen's Knight Defense	1. e4 e5 2. f4 Nc6
1790	C30	King's Gambit Declined: Senechaud Countergambit	1. e4 e5 2. f4 Bc5 3. Nf3 g5
1791	C30	King's Gambit Declined: Soller-Zilbermints Gambit	1. e4 e5 2. f4 f6 3. fxe5 Nc6
1792	C30	King's Gambit Declined: Zilbermints Double Countergambit	1. e4 e5 2. f4 g5
1793	C30	King's Gambit Declined: Zilbermints Double Gambit	1. e4 e5 2. f4 Nc6 3. Nf3 g5
1794	C31	King's Gambit Declined: Falkbeer Countergambit	1. e4 e5 2. f4 d5
1795	C31	King's Gambit Declined: Falkbeer Countergambit Accepted	1. e4 e5 2. f4 d5 3. exd5
1796	C31	King's Gambit Declined: Falkbeer Countergambit, Anderssen Attack	1. e4 e5 2. f4 d5 3. exd5 e4 4. Bb5+
1797	C31	King's Gambit Declined: Falkbeer Countergambit, Blackburne Attack	1. e4 e5 2. f4 d5 3. Nf3
1798	C31	King's Gambit Declined: Falkbeer Countergambit, Charousek Gambit	1. e4 e5 2. f4 d5 3. exd5 e4 4. d3
1799	C31	King's Gambit Declined: Falkbeer Countergambit, Charousek Gambit, Morphy Defense	1. e4 e5 2. Nc3 Nf6 3. f4 d5 4. exd5 e4 5. d3 Bb4 6. Bd2 e3
1800	C31	King's Gambit Declined: Falkbeer Countergambit, Hinrichsen Gambit	1. e4 e5 2. f4 d5 3. d4
1801	C31	King's Gambit Declined: Falkbeer Countergambit, Miles Gambit	1. e4 e5 2. f4 d5 3. exd5 Bc5
1802	C31	King's Gambit Declined: Falkbeer Countergambit, Milner-Barry Variation	1. e4 e5 2. f4 d5 3. Nc3
1803	C31	King's Gambit Declined: Falkbeer Countergambit, Modern Transfer	1. e4 e5 2. f4 d5 3. exd5 exf4
1804	C31	King's Gambit Declined: Falkbeer Countergambit, Nimzowitsch-Marshall Countergambit	1. e4 e5 2. f4 d5 3. exd5 c6
1805	C31	King's Gambit Declined: Falkbeer Countergambit, Pickler Gambit	1. e4 e5 2. f4 d5 3. exd5 c6 4. dxc6 Bc5
1806	C31	King's Gambit Declined: Falkbeer Countergambit, Rubinstein Variation	1. e4 e5 2. f4 d5 3. exd5 e4 4. Nc3 Nf6 5. Qe2
1807	C31	King's Gambit Declined: Falkbeer Countergambit, Staunton Line	1. e4 e5 2. f4 d5 3. exd5 e4
1808	C31	Van Geet Opening: Grünfeld Defense, Steiner Gambit	1. e4 e5 2. f4 d5 3. Nc3 dxe4 4. Nxe4
1809	C32	King's Gambit Declined: Falkbeer Countergambit, Alapin Variation	1. e4 e5 2. f4 d5 3. exd5 e4 4. d3 Nf6 5. dxe4 Nxe4 6. Nf3 Bc5 7. Qe2 Bf2+ 8. Kd1 Qxd5+ 9. Nfd2
1810	C32	King's Gambit Declined: Falkbeer Countergambit, Charousek Gambit	1. e4 e5 2. f4 d5 3. exd5 e4 4. d3 Nf6 5. dxe4 Nxe4 6. Qe2
1811	C32	King's Gambit Declined: Falkbeer Countergambit, Charousek Gambit Accepted	1. e4 e5 2. f4 d5 3. exd5 e4 4. d3 Nf6 5. dxe4
1812	C32	King's Gambit Declined: Falkbeer Countergambit, Charousek Gambit, Keres Variation	1. e4 e5 2. f4 d5 3. exd5 e4 4. d3 Nf6 5. Nd2
1813	C32	King's Gambit Declined: Falkbeer Countergambit, Charousek Gambit, Main Line	1. e4 e5 2. f4 d5 3. exd5 e4 4. d3 Nf6 5. dxe4 Nxe4 6. Nf3 Bc5 7. Qe2 Bf5
1814	C32	King's Gambit Declined: Falkbeer Countergambit, Charousek Gambit, Old Line	1. e4 e5 2. f4 d5 3. exd5 e4 4. d3 Nf6 5. Qe2
1815	C32	King's Gambit Declined: Falkbeer Countergambit, Charousek Variation	1. e4 e5 2. f4 d5 3. exd5 e4 4. d3 Nf6 5. dxe4 Nxe4 6. Qe2 Qxd5 7. Nd2 f5 8. g4
1816	C32	King's Gambit Declined: Falkbeer Countergambit, Tarrasch Variation	1. e4 e5 2. f4 d5 3. exd5 e4 4. d3 Nf6 5. dxe4 Nxe4 6. Nf3 Bc5 7. Qe2 Bf5 8. g4 O-O
1817	C33	King's Gambit Accepted	1. e4 e5 2. f4 exf4
1818	C33	King's Gambit Accepted: Basman Gambit	1. e4 e5 2. f4 exf4 3. Qe2
1819	C33	King's Gambit Accepted: Bishop's Gambit	1. e4 e5 2. f4 exf4 3. Bc4
1820	C33	King's Gambit Accepted: Bishop's Gambit, Anderssen Defense	1. e4 e5 2. f4 exf4 3. Bc4 g5
1821	C33	King's Gambit Accepted: Bishop's Gambit, Anderssen Variation	1. e4 e5 2. f4 exf4 3. Bc4 d5 4. Bxd5 c6
1822	C33	King's Gambit Accepted: Bishop's Gambit, Bledow Countergambit	1. e4 e5 2. f4 exf4 3. Bc4 d5 4. Bxd5 Nf6
1823	C33	King's Gambit Accepted: Bishop's Gambit, Bledow Variation	1. e4 e5 2. f4 exf4 3. Bc4 d5
1824	C33	King's Gambit Accepted: Bishop's Gambit, Boden Variation	1. e4 e5 2. f4 exf4 3. Bc4 Qh4+ 4. Kf1 Nc6
1825	C33	King's Gambit Accepted: Bishop's Gambit, Bogoljubov Defense	1. e4 e5 2. f4 exf4 3. Bc4 Nf6 4. Nc3 c6
1826	C33	King's Gambit Accepted: Bishop's Gambit, Bogoljubov Variation	1. e4 e5 2. f4 exf4 3. Bc4 Nf6 4. Nc3
1827	C33	King's Gambit Accepted: Bishop's Gambit, Boren-Svenonius Variation	1. e4 e5 2. f4 exf4 3. Bc4 d5 4. Bxd5 Qh4+ 5. Kf1 Bd6
1828	C33	King's Gambit Accepted: Bishop's Gambit, Bryan Countergambit	1. e4 e5 2. f4 exf4 3. Bc4 Qh4+ 4. Kf1 b5
1829	C33	King's Gambit Accepted: Bishop's Gambit, Chigorin's Attack	1. e4 e5 2. f4 exf4 3. Bc4 Qh4+ 4. Kf1 d5 5. Bxd5 g5 6. g3
1830	C33	King's Gambit Accepted: Bishop's Gambit, Classical Defense	1. e4 e5 2. f4 exf4 3. Bc4 Qh4+ 4. Kf1 Ne7 5. Nc3 g5 6. d4 Bg7
1831	C33	King's Gambit Accepted: Bishop's Gambit, Classical Defense, Cozio Attack	1. e4 e5 2. f4 exf4 3. Bc4 Qh4+ 4. Kf1 g5 5. Qf3
1832	C33	King's Gambit Accepted: Bishop's Gambit, Cozio Defense	1. e4 e5 2. f4 exf4 3. Bc4 Nf6
1833	C33	King's Gambit Accepted: Bishop's Gambit, Cozio Variation	1. e4 e5 2. f4 exf4 3. Bc4 Qh4+ 4. Kf1 d6
1834	C33	King's Gambit Accepted: Bishop's Gambit, First Jaenisch Variation	1. e4 e5 2. f4 exf4 3. Bc4 Qh4+ 4. Kf1 Nf6
1835	C33	King's Gambit Accepted: Bishop's Gambit, Fraser Variation	1. e4 e5 2. f4 exf4 3. Bc4 Qh4+ 4. Kf1 g5 5. Nc3 Bg7 6. g3 fxg3 7. Qf3
1836	C33	King's Gambit Accepted: Bishop's Gambit, Gianutio Gambit	1. e4 e5 2. f4 exf4 3. Bc4 f5
1837	C33	King's Gambit Accepted: Bishop's Gambit, Greco Variation	1. e4 e5 2. f4 exf4 3. Bc4 Qh4+ 4. Kf1 Bc5
1838	C33	King's Gambit Accepted: Bishop's Gambit, Grimm Attack	1. e4 e5 2. f4 exf4 3. Bc4 Qh4+ 4. Kf1 g5 5. Nc3 Bg7 6. d4 d6 7. e5
1839	C33	King's Gambit Accepted: Bishop's Gambit, Kieseritzky Gambit	1. e4 e5 2. f4 exf4 3. Bc4 b5
1840	C33	King's Gambit Accepted: Bishop's Gambit, Lopez Defense	1. e4 e5 2. f4 exf4 3. Bc4 c6
1841	C33	King's Gambit Accepted: Bishop's Gambit, Lopez Variation	1. e4 e5 2. f4 exf4 3. Bc4 Qh4+ 4. Kf1 g5
1842	C33	King's Gambit Accepted: Bishop's Gambit, Maurian Defense	1. e4 e5 2. f4 exf4 3. Bc4 Nc6
1843	C33	King's Gambit Accepted: Bishop's Gambit, McDonnell Attack	1. e4 e5 2. f4 exf4 3. Bc4 Qh4+ 4. Kf1 g5 5. Nc3 Bg7 6. d4 Ne7 7. g3
1844	C33	King's Gambit Accepted: Bishop's Gambit, McDonnell Attack	1. e4 e5 2. f4 exf4 3. Bc4 Qh4+ 4. Kf1 g5 5. Nc3 Bg7 6. g3
1845	C33	King's Gambit Accepted: Bishop's Gambit, Paulsen Attack	1. e4 e5 2. f4 exf4 3. Bc4 Nf6 4. Nc3 Bb4 5. e5
1846	C33	King's Gambit Accepted: Bishop's Gambit, Steinitz Defense	1. e4 e5 2. f4 exf4 3. Bc4 Ne7
1847	C33	King's Gambit Accepted: Breyer Gambit	1. e4 e5 2. f4 exf4 3. Qf3
1848	C33	King's Gambit Accepted: Carrera Gambit	1. e4 e5 2. f4 exf4 3. Qh5
1849	C33	King's Gambit Accepted: Dodo Variation	1. e4 e5 2. f4 exf4 3. Qg4
1850	C33	King's Gambit Accepted: Eisenberg Variation	1. e4 e5 2. f4 exf4 3. Nh3
1851	C33	King's Gambit Accepted: Gaga Gambit	1. e4 e5 2. f4 exf4 3. g3
1852	C33	King's Gambit Accepted: Lopez-Gianutio Countergambit, Hein Variation	1. e4 e5 2. f4 exf4 3. Bc4 f5 4. Qe2 Qh4+ 5. Kd1 fxe4 6. Nc3 Kd8
1853	C33	King's Gambit Accepted: Mason-Keres Gambit	1. e4 e5 2. f4 exf4 3. Nc3
1854	C33	King's Gambit Accepted: Orsini Gambit	1. e4 e5 2. f4 exf4 3. b3
1855	C33	King's Gambit Accepted: Paris Gambit	1. e4 e5 2. f4 exf4 3. Ne2
1856	C33	King's Gambit Accepted: Polerio Gambit	1. e4 e5 2. f4 exf4 3. d4
1857	C33	King's Gambit Accepted: Schurig Gambit, with Bb5	1. e4 e5 2. f4 exf4 3. Bb5
1858	C33	King's Gambit Accepted: Schurig Gambit, with Bd3	1. e4 e5 2. f4 exf4 3. Bd3
1859	C33	King's Gambit Accepted: Stamma Gambit	1. e4 e5 2. f4 exf4 3. h4
1860	C33	King's Gambit Accepted: Tartakower Gambit	1. e4 e5 2. f4 exf4 3. Be2
1861	C33	King's Gambit Accepted: Tartakower Gambit, Weiss Defense	1. e4 e5 2. f4 exf4 3. Be2 f5 4. exf5 d6
1862	C33	King's Gambit Accepted: Tumbleweed	1. e4 e5 2. f4 exf4 3. Kf2
1863	C34	King's Gambit Accepted: Becker Defense	1. e4 e5 2. f4 exf4 3. Nf3 h6
1864	C34	King's Gambit Accepted: Bonsch-Osmolovsky Variation	1. e4 e5 2. f4 exf4 3. Nf3 Ne7
1865	C34	King's Gambit Accepted: Fischer Defense	1. e4 e5 2. f4 exf4 3. Nf3 d6
1866	C34	King's Gambit Accepted: Fischer Defense, Schulder Gambit	1. e4 e5 2. f4 exf4 3. Nf3 d6 4. b4
1867	C34	King's Gambit Accepted: Fischer Defense, Spanish Variation	1. e4 e5 2. f4 exf4 3. Nf3 d6 4. d4 Nf6 5. Bd3
1868	C34	King's Gambit Accepted: Gianutio Countergambit	1. e4 e5 2. f4 exf4 3. Nf3 f5
1869	C34	King's Gambit Accepted: Greco Gambit	1. e4 e5 2. f4 exf4 3. Nf3 d6 4. Bc4 h6 5. d4 g5 6. h4 Bg7
1870	C34	King's Gambit Accepted: King's Knight's Gambit	1. e4 e5 2. f4 exf4 3. Nf3 g5
1871	C34	King's Gambit Accepted: King's Knight's Gambit	1. e4 e5 2. f4 exf4 3. Nf3
1872	C34	King's Gambit Accepted: MacLeod Defense	1. e4 e5 2. f4 exf4 3. Nf3 Nc6
1873	C34	King's Gambit Accepted: Schallopp Defense	1. e4 e5 2. f4 exf4 3. Nf3 Nf6
1874	C34	King's Gambit Accepted: Schallopp Defense, Tashkent Attack	1. e4 e5 2. f4 exf4 3. Nf3 Nf6 4. e5 Nh5 5. g4
1875	C34	King's Gambit Accepted: Wagenbach Defense	1. e4 e5 2. f4 exf4 3. Nf3 h5
1876	C35	King's Gambit Accepted: Cunningham Defense	1. e4 e5 2. f4 exf4 3. Nf3 Be7
1877	C35	King's Gambit Accepted: Cunningham Defense, Bertin Gambit	1. e4 e5 2. f4 exf4 3. Nf3 Be7 4. Bc4 Bh4+ 5. g3
1878	C35	King's Gambit Accepted: Cunningham Defense, Bertin Gambit	1. e4 e5 2. f4 exf4 3. Nf3 Be7 4. Bc4 Bh4+ 5. g3 fxg3 6. O-O gxh2+ 7. Kh1
1879	C35	King's Gambit Accepted: Cunningham Defense, McCormick Defense	1. e4 e5 2. f4 exf4 3. Nf3 Be7 4. Bc4 Nf6
1880	C36	King's Gambit Accepted: Abbazia Defense	1. e4 e5 2. f4 exf4 3. Nf3 d5 4. exd5 Nf6
1881	C36	King's Gambit Accepted: Abbazia Defense, Main Line	1. e4 e5 2. f4 exf4 3. Nf3 d5 4. exd5 Nf6 5. Bb5+ c6 6. dxc6 bxc6 7. Bc4 Nd5
1882	C36	King's Gambit Accepted: Modern Defense	1. e4 e5 2. f4 exf4 3. Nf3 d5
1883	C36	King's Gambit Accepted: Modern Defense	1. e4 e5 2. f4 exf4 3. Nf3 d5 4. exd5
1884	C37	King's Gambit Accepted: Australian Gambit	1. e4 e5 2. f4 exf4 3. Nf3 g5 4. Bc4 g4 5. h4
1885	C37	King's Gambit Accepted: Blachly Gambit	1. e4 e5 2. f4 exf4 3. Nf3 Nc6 4. Bc4 g5
1886	C37	King's Gambit Accepted: Double Muzio Gambit	1. e4 e5 2. f4 exf4 3. Nf3 g5 4. Bc4 g4 5. O-O gxf3 6. Qxf3 Qf6 7. e5 Qxe5 8. Bxf7+
1887	C37	King's Gambit Accepted: Double Muzio Gambit, Baldwin Gambit	1. e4 e5 2. f4 exf4 3. Nf3 g5 4. Bc4 g4 5. O-O gxf3 6. Qxf3 Qf6 7. Nc3 Qd4+ 8. Kh1 Qxc4 9. Nd5
1888	C37	King's Gambit Accepted: Double Muzio Gambit, Bello Gambit	1. e4 e5 2. f4 exf4 3. Nf3 g5 4. Bc4 g4 5. O-O gxf3 6. Qxf3 Qf6 7. Nc3
1889	C37	King's Gambit Accepted: Double Muzio Gambit, Paulsen Defense	1. e4 e5 2. f4 exf4 3. Nf3 g5 4. Bc4 g4 5. O-O gxf3 6. Qxf3 Qf6 7. e5 Qxe5 8. d3 Bh6 9. Nc3 Ne7 10. Bd2 Nbc6 11. Rae1
1890	C37	King's Gambit Accepted: Double Muzio Gambit, Young Gambit	1. e4 e5 2. f4 exf4 3. Nf3 g5 4. Bc4 g4 5. O-O gxf3 6. Qxf3 Qf6 7. Bxf7+ Kxf7 8. d4 Qxd4+ 9. Be3 Qf6 10. Nc3 fxe3
1891	C37	King's Gambit Accepted: Ghulam-Kassim Gambit	1. e4 e5 2. f4 exf4 3. Nf3 g5 4. Bc4 g4 5. d4
1892	C37	King's Gambit Accepted: Ghulam-Kassim Gambit	1. e4 e5 2. f4 exf4 3. Nf3 g5 4. Bc4 g4 5. d4 gxf3 6. Qxf3
1893	C37	King's Gambit Accepted: King's Knight's Gambit	1. e4 e5 2. f4 exf4 3. Nf3 g5 4. Bc4
1894	C37	King's Gambit Accepted: Kotov Gambit	1. e4 e5 2. f4 exf4 3. Nf3 g5 4. Bc4 g4 5. d4 gxf3 6. Bxf4
1895	C37	King's Gambit Accepted: Lolli Gambit	1. e4 e5 2. f4 exf4 3. Nf3 g5 4. Bc4 g4 5. Bxf7+
1896	C37	King's Gambit Accepted: Lolli Gambit, Young Variation	1. e4 e5 2. f4 exf4 3. Nf3 g5 4. Bc4 g4 5. Bxf7+ Kxf7 6. O-O gxf3 7. Qxf3 Qf6 8. d4 Qxd4+ 9. Be3 Qf6 10. Nc3
1897	C37	King's Gambit Accepted: McDonnell Gambit	1. e4 e5 2. f4 exf4 3. Nf3 g5 4. Bc4 g4 5. Nc3
1898	C37	King's Gambit Accepted: Middleton Countergambit	1. e4 e5 2. f4 exf4 3. Nf3 g5 4. Bc4 d6 5. O-O Bg4 6. h3 h5 7. hxg4 hxg4
1899	C37	King's Gambit Accepted: Muzio Gambit Accepted, From's Defense	1. e4 e5 2. f4 exf4 3. Nf3 g5 4. Bc4 g4 5. O-O gxf3 6. Qxf3 Qe7
1900	C37	King's Gambit Accepted: Muzio Gambit, Brentano Defense	1. e4 e5 2. f4 exf4 3. Nf3 g5 4. Bc4 g4 5. O-O d5
1901	C37	King's Gambit Accepted: Muzio Gambit, Holloway Defense	1. e4 e5 2. f4 exf4 3. Nf3 g5 4. Bc4 g4 5. O-O gxf3 6. Qxf3 Nc6
1902	C37	King's Gambit Accepted: Muzio Gambit, Kling and Horwitz Counterattack	1. e4 e5 2. f4 exf4 3. Nf3 g5 4. Bc4 g4 5. O-O Qe7
1903	C37	King's Gambit Accepted: Muzio Gambit, Sarratt Defense	1. e4 e5 2. f4 exf4 3. Nf3 g5 4. Bc4 g4 5. O-O gxf3 6. Qxf3 Qf6
1904	C37	King's Gambit Accepted: Muzio Gambit, Wild Muzio Gambit	1. e4 e5 2. f4 exf4 3. Nf3 g5 4. Bc4 g4 5. O-O
1905	C37	King's Gambit Accepted: Quade Gambit	1. e4 e5 2. f4 exf4 3. Nf3 g5 4. Nc3
1906	C37	King's Gambit Accepted: Rosentreter Gambit	1. e4 e5 2. f4 exf4 3. Nf3 g5 4. d4
1907	C37	King's Gambit Accepted: Rosentreter Gambit, Bird Gambit	1. e4 e5 2. f4 exf4 3. Nf3 g5 4. d4 g4 5. Ne5 Qh4+ 6. g3
1908	C37	King's Gambit Accepted: Rosentreter Gambit, Sörensen Gambit	1. e4 e5 2. f4 exf4 3. Nf3 g5 4. d4 g4 5. Nc3
1909	C37	King's Gambit Accepted: Rosentreter Gambit, Testa Variation	1. e4 e5 2. f4 exf4 3. Nf3 g5 4. d4 g4 5. Bxf4
1910	C37	King's Gambit Accepted: Salvio Gambit	1. e4 e5 2. f4 exf4 3. Nf3 g5 4. Bc4 g4 5. Ne5
1911	C37	King's Gambit Accepted: Salvio Gambit, Anderssen Counterattack	1. e4 e5 2. f4 exf4 3. Nf3 g5 4. Bc4 g4 5. Ne5 Qh4+ 6. Kf1 Nh6 7. d4 d6
1912	C37	King's Gambit Accepted: Salvio Gambit, Cochrane Gambit	1. e4 e5 2. f4 exf4 3. Nf3 g5 4. Bc4 g4 5. Ne5 Qh4+ 6. Kf1 f3
1913	C37	King's Gambit Accepted: Salvio Gambit, Santa Maria Defense	1. e4 e5 2. f4 exf4 3. Nf3 g5 4. Bc4 g4 5. Ne5 Qh4+ 6. Kf1 Nf6
1914	C37	King's Gambit Accepted: Salvio Gambit, Silberschmidt Defense	1. e4 e5 2. f4 exf4 3. Nf3 g5 4. Bc4 g4 5. Ne5 Qh4+ 6. Kf1 Nh6
1915	C37	King's Gambit Accepted: Salvio Gambit, Viennese Variation	1. e4 e5 2. f4 exf4 3. Nf3 g5 4. Bc4 g4 5. Ne5 Qh4+ 6. Kf1 Nc6
1916	C37	King's Gambit Accepted: Silberschmidt Gambit	1. e4 e5 2. f4 exf4 3. Nf3 g5 4. Bc4 g4 5. Ne5 Qh4+ 6. Kf1 Nh6 7. d4 f3
1917	C37	King's Gambit Accepted: Sörensen Gambit	1. e4 e5 2. f4 exf4 3. Nf3 g5 4. d4 g4 5. Ne5
1918	C38	King's Gambit Accepted: Greco Gambit	1. e4 e5 2. f4 exf4 3. Nf3 g5 4. Bc4 Bg7 5. h4 h6 6. d4 d6 7. Nc3 c6 8. hxg5 hxg5 9. Rxh8 Bxh8 10. Ne5
1919	C38	King's Gambit Accepted: Hanstein Gambit	1. e4 e5 2. f4 exf4 3. Nf3 g5 4. Bc4 Bg7 5. O-O
1920	C38	King's Gambit Accepted: Mayet Gambit	1. e4 e5 2. f4 exf4 3. Nf3 g5 4. Bc4 Bg7 5. d4 d6 6. c3
1921	C38	King's Gambit Accepted: Philidor Gambit	1. e4 e5 2. f4 exf4 3. Nf3 g5 4. Bc4 Bg7 5. h4
