Index	eco	name	pgn
2595	C97	Ruy Lopez: Closed, Chigorin Defense	1. e4 e5 2. Nf3 Nc6 3. Bb5 a6 4. Ba4 Nf6 5. O-O Be7 6. Re1 b5 7. Bb3 d6 8. c3 O-O 9. h3 Na5 10. Bc2 c5 11. d4 Qc7
2596	C97	Ruy Lopez: Closed, Chigorin, Yugoslav System	1. e4 e5 2. Nf3 Nc6 3. Bb5 a6 4. Ba4 Nf6 5. O-O Be7 6. Re1 b5 7. Bb3 d6 8. c3 O-O 9. h3 Na5 10. Bc2 c5 11. d4 Qc7 12. Nbd2 Bd7 13. Nf1 Rfe8 14. Ne3 g6
2597	C98	Ruy Lopez: Closed, Chigorin Defense	1. e4 e5 2. Nf3 Nc6 3. Bb5 a6 4. Ba4 Nf6 5. O-O Be7 6. Re1 b5 7. Bb3 d6 8. c3 O-O 9. h3 Na5 10. Bc2 c5 11. d4 Qc7 12. Nbd2 Nc6
2598	C98	Ruy Lopez: Closed, Chigorin Defense	1. e4 e5 2. Nf3 Nc6 3. Bb5 a6 4. Ba4 Nf6 5. O-O Be7 6. Re1 b5 7. Bb3 d6 8. c3 O-O 9. h3 Na5 10. Bc2 c5 11. d4 Qc7 12. Nbd2 Nc6 13. dxc5
2599	C99	Ruy Lopez: Closed, Chigorin Defense, Panov System	1. e4 e5 2. Nf3 Nc6 3. Bb5 a6 4. Ba4 Nf6 5. O-O Be7 6. Re1 b5 7. Bb3 d6 8. c3 O-O 9. h3 Na5 10. Bc2 c5 11. d4 Qc7 12. Nbd2 cxd4 13. cxd4
2600	D00	Amazon Attack	1. d4 d5 2. Qd3
2601	D00	Blackmar-Diemer Gambit	1. d4 d5 2. e4
2602	D00	Blackmar-Diemer Gambit	1. d4 d5 2. e4 dxe4 3. Nc3 Nf6
2603	D00	Blackmar-Diemer Gambit Accepted	1. d4 d5 2. e4 dxe4 3. Nc3 Nf6 4. f3 exf3
2604	D00	Blackmar-Diemer Gambit Accepted: Bogoljubow Defense	1. d4 d5 2. e4 dxe4 3. Nc3 Nf6 4. f3 exf3 5. Nxf3 g6
2605	D00	Blackmar-Diemer Gambit Accepted: Bogoljubow Defense, Kloss Attack	1. d4 d5 2. e4 dxe4 3. Nc3 Nf6 4. f3 exf3 5. Nxf3 g6 6. Bc4 Bg7 7. O-O O-O 8. Kh1
2606	D00	Blackmar-Diemer Gambit Accepted: Bogoljubow Defense, Mad Dog Attack	1. d4 d5 2. e4 dxe4 3. Nc3 Nf6 4. f3 exf3 5. Nxf3 g6 6. Bc4 Bg7 7. h4
2607	D00	Blackmar-Diemer Gambit Accepted: Bogoljubow Defense, Nimzowitsch Attack	1. d4 d5 2. e4 dxe4 3. Nc3 Nf6 4. f3 exf3 5. Nxf3 g6 6. Bc4 Bg7 7. Ne5
2608	D00	Blackmar-Diemer Gambit Accepted: Bogoljubow Defense, Studier Attack	1. d4 d5 2. e4 dxe4 3. Nc3 Nf6 4. f3 exf3 5. Nxf3 g6 6. Bc4 Bg7 7. O-O O-O 8. Qe1
2609	D00	Blackmar-Diemer Gambit Accepted: Euwe Defense	1. d4 d5 2. e4 dxe4 3. Nc3 Nf6 4. f3 exf3 5. Nxf3 e6
2610	D00	Blackmar-Diemer Gambit Accepted: Euwe Defense, Zilbermints Gambit	1. d4 d5 2. e4 dxe4 3. Nc3 Nf6 4. f3 exf3 5. Nxf3 e6 6. Bg5 Be7 7. Bd3 Nc6 8. O-O Nxd4 9. Kh1
2611	D00	Blackmar-Diemer Gambit Accepted: Gunderam Defense	1. d4 d5 2. e4 dxe4 3. Nc3 Nf6 4. f3 exf3 5. Nxf3 Bf5
2612	D00	Blackmar-Diemer Gambit Accepted: Gunderam Defense, Stader Variation	1. d4 d5 2. e4 dxe4 3. Nc3 Nf6 4. f3 exf3 5. Nxf3 Bf5 6. Ne5 e6 7. g4 Be4
2613	D00	Blackmar-Diemer Gambit Accepted: Holwell Defense	1. d4 d5 2. e4 dxe4 3. Nc3 Nf6 4. f3 exf3 5. Nxf3 Qd6
2614	D00	Blackmar-Diemer Gambit Accepted: Kaulich Defense	1. d4 d5 2. e4 dxe4 3. Nc3 Nf6 4. f3 exf3 5. Nxf3 c5
2615	D00	Blackmar-Diemer Gambit Accepted: Pietrowsky Defense	1. d4 d5 2. e4 dxe4 3. Nc3 Nf6 4. f3 exf3 5. Nxf3 Nc6
2616	D00	Blackmar-Diemer Gambit Accepted: Ritter Defense	1. d4 d5 2. e4 dxe4 3. Nc3 Nf6 4. f3 exf3 5. Nxf3 b6
2617	D00	Blackmar-Diemer Gambit Accepted: Ryder Gambit	1. d4 d5 2. e4 dxe4 3. Nc3 Nf6 4. f3 exf3 5. Qxf3
2618	D00	Blackmar-Diemer Gambit Accepted: Schlutter Defense	1. d4 d5 2. e4 dxe4 3. Nc3 Nf6 4. f3 exf3 5. Nxf3 Nbd7
2619	D00	Blackmar-Diemer Gambit Accepted: Teichmann Defense	1. d4 d5 2. e4 dxe4 3. Nc3 Nf6 4. f3 exf3 5. Nxf3 Bg4
2620	D00	Blackmar-Diemer Gambit Accepted: Teichmann Defense, Ciesielski Variation	1. d4 d5 2. e4 dxe4 3. Nc3 Nf6 4. f3 exf3 5. Nxf3 Bg4 6. h3 Bxf3 7. Qxf3 c6 8. Qf2
2621	D00	Blackmar-Diemer Gambit Accepted: Teichmann Defense, Classical Variation	1. d4 d5 2. e4 dxe4 3. Nc3 Nf6 4. f3 exf3 5. Nxf3 Bg4 6. h3 Bxf3 7. Qxf3 c6 8. Be3
2622	D00	Blackmar-Diemer Gambit Accepted: Teichmann Defense, Seidel-Hall Attack	1. d4 d5 2. e4 dxe4 3. Nc3 Nf6 4. f3 exf3 5. Nxf3 Bg4 6. h3 Bxf3 7. Qxf3 c6 8. g4
2623	D00	Blackmar-Diemer Gambit Accepted: Ziegler Defense	1. d4 d5 2. e4 dxe4 3. Nc3 Nf6 4. f3 exf3 5. Nxf3 c6
2624	D00	Blackmar-Diemer Gambit Declined: Brombacher Countergambit	1. d4 d5 2. e4 dxe4 3. Nc3 Nf6 4. f3 c5
2625	D00	Blackmar-Diemer Gambit Declined: Elbert Countergambit	1. d4 d5 2. e4 dxe4 3. Nc3 Nf6 4. f3 e5
2626	D00	Blackmar-Diemer Gambit Declined: Gedult Defense	1. d4 d5 2. e4 dxe4 3. Nc3 Nf6 4. f3 a6
2627	D00	Blackmar-Diemer Gambit Declined: Lamb Defense	1. d4 d5 2. e4 dxe4 3. Nc3 Nf6 4. f3 Nc6
2628	D00	Blackmar-Diemer Gambit Declined: Langeheinicke Defense	1. d4 d5 2. e4 dxe4 3. Nc3 Nf6 4. f3 e3
2629	D00	Blackmar-Diemer Gambit Declined: O'Kelly Defense	1. d4 d5 2. e4 dxe4 3. Nc3 Nf6 4. f3 c6
2630	D00	Blackmar-Diemer Gambit Declined: Vienna Defense	1. d4 d5 2. e4 dxe4 3. Nc3 Nf6 4. f3 Bf5
2631	D00	Blackmar-Diemer Gambit Declined: Weinsbach Defense	1. d4 d5 2. e4 dxe4 3. Nc3 Nf6 4. f3 e6
2632	D00	Blackmar-Diemer Gambit: Blackmar Gambit	1. d4 d5 2. e4 dxe4 3. f3
2633	D00	Blackmar-Diemer Gambit: Diemer-Rosenberg Attack	1. d4 d5 2. e4 dxe4 3. Be3
2634	D00	Blackmar-Diemer Gambit: Fritz Attack	1. d4 d5 2. e4 dxe4 3. Bc4
2635	D00	Blackmar-Diemer Gambit: Lemberger Countergambit	1. d4 d5 2. e4 dxe4 3. Nc3 e5
2636	D00	Blackmar-Diemer Gambit: Lemberger Countergambit, Endgame Variation	1. d4 d5 2. e4 dxe4 3. Nc3 e5 4. dxe5
2637	D00	Blackmar-Diemer Gambit: Lemberger Countergambit, Lange Gambit	1. d4 d5 2. e4 dxe4 3. Nc3 e5 4. Nxe4
2638	D00	Blackmar-Diemer Gambit: Lemberger Countergambit, Rasmussen Attack	1. d4 d5 2. e4 dxe4 3. Nc3 e5 4. Nge2
2639	D00	Blackmar-Diemer Gambit: Lemberger Countergambit, Sneiders Attack	1. d4 d5 2. e4 dxe4 3. Nc3 e5 4. Qh5
2640	D00	Blackmar-Diemer Gambit: Lemberger Countergambit, Soller Attack	1. d4 d5 2. e4 dxe4 3. Nc3 e5 4. Be3
2641	D00	Blackmar-Diemer Gambit: Netherlands Variation	1. d4 d5 2. e4 dxe4 3. Nc3 f5
2642	D00	Blackmar-Diemer Gambit: Rasa-Studier Gambit	1. d4 d5 2. e4 dxe4 3. Nc3 Nf6 4. Be3
2643	D00	Blackmar-Diemer Gambit: Reversed Albin Countergambit	1. d4 d5 2. e4 dxe4 3. Nc3 c5
2644	D00	Blackmar-Diemer Gambit: Zeller Defense	1. d4 d5 2. e4 dxe4 3. Nc3 Bf5
2645	D00	Blackmar-Diemer Gambit: Zeller Defense, Soller Attack	1. d4 d5 2. e4 dxe4 3. Nc3 Bf5 4. f3 Nf6 5. Bc4
2646	D00	Blackmar-Diemer Gambit: von Popiel Gambit	1. d4 d5 2. e4 dxe4 3. Nc3 Nf6 4. Bg5
2647	D00	Blackmar-Diemer Gambit: von Popiel Gambit, Zilbermints Variation	1. d4 d5 2. e4 dxe4 3. Nc3 Nf6 4. Bg5 Bf5 5. Bxf6 exf6 6. g4 Bg6 7. Qe2 Bb4 8. Qb5+
2648	D00	Queen's Pawn Game	1. d4 d5
2649	D00	Queen's Pawn Game	1. d4 d5 2. e3
2650	D00	Queen's Pawn Game	1. d4 d5 2. e3 Nf6
2651	D00	Queen's Pawn Game: Accelerated London System	1. d4 d5 2. Bf4
2652	D00	Queen's Pawn Game: Accelerated London System, Steinitz Countergambit	1. d4 d5 2. Bf4 c5
2653	D00	Queen's Pawn Game: Accelerated London System, Steinitz Countergambit Accepted	1. d4 d5 2. Bf4 c5 3. dxc5
2654	D00	Queen's Pawn Game: Accelerated London System, Steinitz Countergambit, Morris Countergambit	1. d4 d5 2. Bf4 c5 3. e4
2655	D00	Queen's Pawn Game: Accelerated London System, Steinitz Countergambit, Morris Countergambit Accepted	1. d4 d5 2. Bf4 c5 3. e4 dxe4
2656	D00	Queen's Pawn Game: Chigorin Variation	1. d4 d5 2. Nc3
2657	D00	Queen's Pawn Game: Chigorin Variation, Alburt Defense	1. d4 d5 2. Nc3 Bf5
2658	D00	Queen's Pawn Game: Chigorin Variation, Anti-Veresov	1. d4 d5 2. Nc3 Bg4
2659	D00	Queen's Pawn Game: Chigorin Variation, Fianchetto Defense	1. d4 g6 2. Nf3 Bg7 3. Nc3 d5
2660	D00	Queen's Pawn Game: Chigorin Variation, Irish Gambit	1. d4 d5 2. Nc3 c5
2661	D00	Queen's Pawn Game: Chigorin Variation, Shaviliuk Gambit	1. d4 d5 2. Nc3 e5
2662	D00	Queen's Pawn Game: Chigorin Variation, Shropshire Defense	1. d4 d5 2. Nc3 h5
2663	D00	Queen's Pawn Game: Hübsch Gambit	1. d4 Nf6 2. Nc3 d5 3. e4
2664	D00	Queen's Pawn Game: Levitsky Attack	1. d4 d5 2. Bg5
2665	D00	Queen's Pawn Game: Levitsky Attack, Welling Variation	1. d4 d5 2. Bg5 Bg4
2666	D00	Queen's Pawn Game: Mason Attack	1. d4 d5 2. f4
2667	D00	Queen's Pawn Game: Stonewall Attack	1. d4 d5 2. e3 Nf6 3. Bd3
2668	D00	Queen's Pawn Game: Zurich Gambit	1. d4 d5 2. g4
2669	D01	Rapport-Jobava System	1. d4 d5 2. Nc3 Nf6 3. Bf4
2670	D01	Richter-Veresov Attack	1. d4 Nf6 2. Nc3 d5 3. Bg5
2671	D01	Richter-Veresov Attack	1. d4 Nf6 2. Nc3 d5 3. Bg5 Bf5
2672	D01	Richter-Veresov Attack: Boyce Defense	1. d4 Nf6 2. Nc3 d5 3. Bg5 Ne4
2673	D01	Richter-Veresov Attack: Malich Gambit	1. d4 Nf6 2. Nc3 d5 3. Bg5 c5 4. Bxf6 gxf6 5. e4 dxe4 6. d5
2674	D01	Richter-Veresov Attack: Richter Variation	1. d4 Nf6 2. Nc3 d5 3. Bg5 Bf5 4. f3
2675	D01	Richter-Veresov Attack: Two Knights System	1. d4 Nf6 2. Nc3 d5 3. Bg5 Nbd7 4. Nf3
2676	D01	Richter-Veresov Attack: Two Knights System, Grünfeld Defense	1. d4 Nf6 2. Nc3 d5 3. Bg5 Nbd7 4. Nf3 g6
2677	D01	Richter-Veresov Attack: Veresov Variation	1. d4 Nf6 2. Nc3 d5 3. Bg5 Bf5 4. Bxf6
2678	D02	London System: Poisoned Pawn Variation	1. d4 Nf6 2. Nf3 d5 3. Bf4 c5 4. e3 Qb6 5. Nc3
2679	D02	Queen's Gambit Declined: Baltic Defense, Pseudo-Slav	1. d4 d5 2. Nf3 Bf5 3. c4 e6 4. Nc3 c6
2680	D02	Queen's Pawn Game: Anti-Torre	1. Nf3 d5 2. d4 Bg4
2681	D02	Queen's Pawn Game: Chandler Gambit	1. d4 d5 2. Nf3 c5 3. g3 cxd4 4. Bg2
2682	D02	Queen's Pawn Game: Chigorin Variation	1. d4 d5 2. Nf3 Nc6
2683	D02	Queen's Pawn Game: Krause Variation	1. d4 d5 2. Nf3 c5
2684	D02	Queen's Pawn Game: Levitsky Attack, Euwe Variation, Modern Line	1. d4 d5 2. Nf3 c6 3. Bg5 h6 4. Bh4 Qb6
2685	D02	Queen's Pawn Game: London System	1. d4 d5 2. Nf3 Nf6 3. Bf4
2686	D02	Queen's Pawn Game: London System, Pterodactyl Variation	1. d4 g6 2. Nf3 Bg7 3. Bf4 c5 4. c3 cxd4 5. cxd4 Qa5+
2687	D02	Queen's Pawn Game: Symmetrical Variation	1. d4 d5 2. Nf3 Nf6
2688	D02	Queen's Pawn Game: Symmetrical Variation, Pseudo-Catalan	1. d4 d5 2. Nf3 Nf6 3. g3
2689	D02	Queen's Pawn Game: Zilbermints Countergambit	1. d4 d5 2. Nf3 Nf6 3. c4 b5
2690	D02	Queen's Pawn Game: Zukertort Variation	1. d4 d5 2. Nf3
2691	D03	Queen's Pawn Game: Torre Attack	1. d4 d5 2. Nf3 Nf6 3. Bg5
2692	D03	Queen's Pawn Game: Torre Attack, Gossip Variation	1. d4 d5 2. Nf3 Nf6 3. Bg5 Ne4
2693	D03	Queen's Pawn Game: Torre Attack, Grünfeld Variation	1. d4 d5 2. Nf3 Nf6 3. Bg5 g6
2694	D04	Queen's Pawn Game: Colle System	1. d4 d5 2. Nf3 Nf6 3. e3
2695	D04	Queen's Pawn Game: Colle System, Anti-Colle	1. d4 d5 2. Nf3 Nf6 3. e3 Bf5
2696	D04	Queen's Pawn Game: Colle System, Grünfeld Formation	1. d4 d5 2. Nf3 Nf6 3. e3 g6 4. Bd3 Bg7
2697	D05	Queen's Pawn Game: Colle System	1. d4 d5 2. Nf3 Nf6 3. e3 e6
2698	D05	Queen's Pawn Game: Colle System	1. d4 d5 2. Nf3 Nf6 3. e3 e6 4. Bd3
2699	D05	Queen's Pawn Game: Colle System, Traditional Colle	1. d4 Nf6 2. Nf3 e6 3. e3 c5 4. Bd3 d5 5. c3
2700	D05	Queen's Pawn Game: Zukertort Variation	1. d4 d5 2. Nf3 c5 3. e3 Nf6 4. Nbd2 e6 5. b3
2701	D05	Rubinstein Opening	1. d4 Nf6 2. Nf3 e6 3. e3 c5 4. Bd3 d5 5. b3
2702	D05	Rubinstein Opening: Bogoljubov Defense	1. d4 Nf6 2. Nf3 e6 3. e3 c5 4. Bd3 d5 5. b3 Nc6 6. O-O Bd6 7. Bb2 O-O
2703	D05	Rubinstein Opening: Classical Defense	1. d4 Nf6 2. Nf3 e6 3. e3 c5 4. Bd3 d5 5. b3 Nc6 6. O-O Be7 7. Bb2 O-O
2704	D05	Rubinstein Opening: Semi-Slav Defense	1. d4 d5 2. Nf3 Nf6 3. e3 e6 4. Bd3 Bd6 5. O-O O-O 6. b3 Nbd7 7. Bb2
2705	D06	Queen's Gambit	1. d4 d5 2. c4
2706	D06	Queen's Gambit Declined: Austrian Attack, Salvio Countergambit	1. d4 d5 2. c4 c5 3. dxc5 d4
2707	D06	Queen's Gambit Declined: Austrian Defense	1. d4 d5 2. c4 c5
2708	D06	Queen's Gambit Declined: Austrian Defense, Gusev Countergambit	1. d4 d5 2. c4 c5 3. cxd5 Nf6
2709	D06	Queen's Gambit Declined: Austrian Defense, Haberditz Variation	1. d4 d5 2. c4 c5 3. cxd5 Nf6 4. e4 Nxe4 5. dxc5 Qa5+
2710	D06	Queen's Gambit Declined: Baltic Defense	1. d4 d5 2. c4 Bf5
2711	D06	Queen's Gambit Declined: Baltic Defense, Argentinian Gambit	1. d4 d5 2. c4 Bf5 3. cxd5 Bxb1 4. Qa4+ c6 5. dxc6 Nxc6
2712	D06	Queen's Gambit Declined: Baltic Defense, Pseudo-Chigorin	1. d4 d5 2. c4 Bf5 3. Nc3 e6 4. Nf3 Nc6
2713	D06	Queen's Gambit Declined: Baltic Defense, Queen Attack	1. d4 d5 2. c4 Bf5 3. Qb3
2714	D06	Queen's Gambit Declined: Baltic Defense, Queen Attack Deferred	1. d4 d5 2. c4 Bf5 3. Nc3 e6 4. Qb3
2715	D06	Queen's Gambit Declined: Marshall Defense	1. d4 d5 2. c4 Nf6
2716	D06	Queen's Gambit Declined: Marshall Defense, Tan Gambit	1. d4 d5 2. c4 Nf6 3. cxd5 c6
2717	D06	Queen's Gambit Declined: Zilbermints Gambit	1. d4 d5 2. c4 b5
2718	D07	Queen's Gambit Declined: Chigorin Defense	1. d4 d5 2. c4 Nc6
2719	D07	Queen's Gambit Declined: Chigorin Defense	1. d4 d5 2. c4 Nc6 3. Nc3
2720	D07	Queen's Gambit Declined: Chigorin Defense	1. d4 d5 2. c4 Nc6 3. Nc3 dxc4
2721	D07	Queen's Gambit Declined: Chigorin Defense, Exchange Variation	1. d4 d5 2. c4 Nc6 3. cxd5 Qxd5
2722	D07	Queen's Gambit Declined: Chigorin Defense, Exchange Variation, Costa's Line	1. d4 d5 2. c4 Nc6 3. cxd5 Qxd5 4. e3 e5 5. Nc3 Bb4 6. Bd2 Bxc3 7. Bxc3 exd4 8. Ne2
2723	D07	Queen's Gambit Declined: Chigorin Defense, Janowski Variation	1. d4 d5 2. c4 Nc6 3. Nc3 dxc4 4. Nf3
2724	D07	Queen's Gambit Declined: Chigorin Defense, Lazard Gambit	1. d4 d5 2. c4 Nc6 3. Nf3 e5
2725	D07	Queen's Gambit Declined: Chigorin Defense, Main Line	1. d4 d5 2. c4 Nc6 3. Nf3 Bg4
2726	D07	Queen's Gambit Declined: Chigorin Defense, Main Line, Alekhine Variation	1. d4 d5 2. c4 Nc6 3. Nf3 Bg4 4. Qa4
2727	D07	Queen's Gambit Declined: Chigorin Defense, Modern Gambit	1. d4 d5 2. c4 Nc6 3. Nc3 dxc4 4. Nf3 Nf6
2728	D07	Queen's Gambit Declined: Chigorin Defense, Tartakower Gambit	1. d4 d5 2. c4 Nc6 3. Nc3 e5
2729	D08	Queen's Gambit Declined: Albin Countergambit	1. d4 d5 2. c4 e5
2730	D08	Queen's Gambit Declined: Albin Countergambit, Balogh Variation	1. d4 d5 2. c4 e5 3. dxe5 d4 4. Nf3 Nc6 5. Nbd2 Qe7
2731	D08	Queen's Gambit Declined: Albin Countergambit, Janowski Variation	1. d4 d5 2. c4 e5 3. dxe5 d4 4. Nf3 Nc6 5. Nbd2 f6
2732	D08	Queen's Gambit Declined: Albin Countergambit, Krenosz Variation	1. d4 d5 2. c4 e5 3. dxe5 d4 4. Nf3 Nc6 5. Nbd2 Bg4 6. h3 Bxf3 7. Nxf3 Bb4+ 8. Bd2 Qe7
2733	D08	Queen's Gambit Declined: Albin Countergambit, Lasker Trap	1. d4 d5 2. c4 e5 3. dxe5 d4 4. e3 Bb4+ 5. Bd2 dxe3
2734	D08	Queen's Gambit Declined: Albin Countergambit, Modern Line	1. d4 d5 2. c4 e5 3. dxe5 d4 4. Nf3 Nc6 5. Nbd2
2735	D08	Queen's Gambit Declined: Albin Countergambit, Normal Line	1. d4 d5 2. c4 e5 3. dxe5 d4 4. Nf3
2736	D08	Queen's Gambit Declined: Albin Countergambit, Tartakower Defense	1. d4 d5 2. c4 e5 3. dxe5 d4 4. Nf3 c5
2737	D09	Queen's Gambit Declined: Albin Countergambit, Fianchetto Variation	1. d4 d5 2. c4 e5 3. dxe5 d4 4. Nf3 Nc6 5. g3
2738	D09	Queen's Gambit Declined: Albin Countergambit, Fianchetto Variation, Be6 Line	1. d4 d5 2. c4 e5 3. dxe5 d4 4. Nf3 Nc6 5. g3 Be6
2739	D09	Queen's Gambit Declined: Albin Countergambit, Fianchetto Variation, Bf5 Line	1. d4 d5 2. c4 e5 3. dxe5 d4 4. Nf3 Nc6 5. g3 Bf5
2740	D09	Queen's Gambit Declined: Albin Countergambit, Fianchetto Variation, Bg4 Line	1. d4 d5 2. c4 e5 3. dxe5 d4 4. Nf3 Nc6 5. g3 Bg4
2741	D10	Slav Defense	1. d4 d5 2. c4 c6
2742	D10	Slav Defense	1. d4 d5 2. c4 c6 3. Nc3
2743	D10	Slav Defense	1. d4 d5 2. c4 c6 3. Nc3 dxc4
2744	D10	Slav Defense: Diemer Gambit	1. d4 d5 2. c4 c6 3. e4
2745	D10	Slav Defense: Exchange Variation	1. d4 d5 2. c4 c6 3. cxd5
2746	D10	Slav Defense: Exchange Variation, Boor Attack	1. d4 d5 2. c4 c6 3. cxd5 cxd5 4. Nc3 Nf6 5. f3
2747	D10	Slav Defense: Slav Gambit, Alekhine Attack	1. d4 d5 2. c4 c6 3. Nc3 dxc4 4. e4
2748	D10	Slav Defense: Winawer Countergambit	1. d4 d5 2. c4 c6 3. Nc3 e5
2749	D10	Slav Defense: Winawer Countergambit, Anti-Winawer Gambit	1. d4 d5 2. c4 c6 3. Nc3 e5 4. e4
2750	D11	Slav Defense: Bonet Gambit	1. d4 d5 2. c4 c6 3. Nf3 Nf6 4. Bg5
2751	D11	Slav Defense: Breyer Variation	1. d4 d5 2. c4 c6 3. Nf3 Nf6 4. Nbd2
2752	D11	Slav Defense: Modern Line	1. d4 d5 2. c4 c6 3. Nf3
2753	D11	Slav Defense: Quiet Variation	1. d4 d5 2. c4 c6 3. Nf3 Nf6 4. e3
2754	D11	Slav Defense: Quiet Variation, Pin Defense	1. d4 d5 2. c4 c6 3. Nf3 Nf6 4. e3 Bg4
2755	D12	Slav Defense: Quiet Variation, Amsterdam Variation	1. d4 d5 2. c4 c6 3. Nf3 Nf6 4. e3 Bf5 5. cxd5 cxd5 6. Nc3 e6 7. Ne5 Nfd7
2756	D12	Slav Defense: Quiet Variation, Landau Variation	1. d4 d5 2. c4 c6 3. Nf3 Nf6 4. e3 Bf5 5. cxd5 cxd5 6. Qb3 Qc8 7. Bd2 e6 8. Na3
2757	D12	Slav Defense: Quiet Variation, Schallopp Defense	1. d4 d5 2. c4 c6 3. Nf3 Nf6 4. e3 Bf5
2758	D13	Slav Defense: Exchange Variation	1. d4 d5 2. c4 c6 3. Nf3 Nf6 4. cxd5 cxd5
2759	D13	Slav Defense: Exchange Variation, Schallopp Variation	1. d4 d5 2. c4 c6 3. Nf3 Nf6 4. e3 Bf5 5. cxd5 cxd5 6. Nc3
2760	D14	Slav Defense: Exchange Variation, Symmetrical Line	1. d4 d5 2. c4 c6 3. cxd5 cxd5 4. Nc3 Nf6 5. Nf3 Nc6 6. Bf4 Bf5
2761	D14	Slav Defense: Exchange Variation, Trifunovic Variation	1. d4 d5 2. c4 c6 3. Nf3 Nf6 4. cxd5 cxd5 5. Nc3 Nc6 6. Bf4 Bf5 7. e3 e6 8. Qb3 Bb4
2762	D15	Slav Defense: Alekhine Variation	1. d4 d5 2. c4 c6 3. Nf3 Nf6 4. Nc3 dxc4 5. e3
2763	D15	Slav Defense: Chameleon Variation	1. d4 d5 2. c4 c6 3. Nf3 Nf6 4. Nc3 a6
2764	D15	Slav Defense: Chameleon Variation, Advance System	1. d4 d5 2. c4 c6 3. Nf3 Nf6 4. Nc3 a6 5. c5
2765	D15	Slav Defense: Geller Gambit	1. d4 d5 2. c4 c6 3. Nf3 Nf6 4. Nc3 dxc4 5. e4
2766	D15	Slav Defense: Geller Gambit	1. d4 d5 2. c4 c6 3. Nf3 Nf6 4. Nc3 dxc4 5. e4 b5 6. e5
2767	D15	Slav Defense: Schlechter Variation	1. d4 d5 2. c4 c6 3. Nf3 Nf6 4. Nc3 g6
2768	D15	Slav Defense: Süchting Variation	1. d4 d5 2. c4 c6 3. Nf3 Nf6 4. Nc3 Qb6
2769	D15	Slav Defense: Three Knights Variation	1. d4 d5 2. c4 c6 3. Nf3 Nf6 4. Nc3
2770	D15	Slav Defense: Two Knights Attack	1. d4 d5 2. c4 c6 3. Nf3 Nf6 4. Nc3 dxc4
2771	D16	Slav Defense: Alapin Variation	1. d4 d5 2. c4 c6 3. Nf3 Nf6 4. Nc3 dxc4 5. a4
2772	D16	Slav Defense: Smyslov Variation	1. d4 d5 2. c4 c6 3. Nf3 Nf6 4. Nc3 dxc4 5. a4 Na6
2773	D16	Slav Defense: Soultanbeieff Variation	1. d4 d5 2. c4 c6 3. Nf3 Nf6 4. Nc3 dxc4 5. a4 e6
2774	D16	Slav Defense: Steiner Variation	1. d4 d5 2. c4 c6 3. Nf3 Nf6 4. Nc3 dxc4 5. a4 Bg4
2775	D17	Slav Defense: Czech Variation	1. d4 d5 2. c4 c6 3. Nf3 Nf6 4. Nc3 dxc4 5. a4 Bf5
2776	D17	Slav Defense: Czech Variation, Bled Attack	1. d4 d5 2. c4 c6 3. Nf3 Nf6 4. Nc3 dxc4 5. a4 Bf5 6. Nh4
2777	D17	Slav Defense: Czech Variation, Carlsbad Variation	1. d4 d5 2. c4 c6 3. Nf3 Nf6 4. Nc3 dxc4 5. a4 Bf5 6. Ne5 Nbd7 7. Nxc4 Qc7 8. g3 e5
2778	D17	Slav Defense: Czech Variation, Carlsbad Variation, Morozevich Variation	1. d4 d5 2. c4 c6 3. Nf3 Nf6 4. Nc3 dxc4 5. a4 Bf5 6. Ne5 Nbd7 7. Nxc4 Qc7 8. g3 e5 9. dxe5 Nxe5 10. Bf4 Nfd7 11. Bg2 g5
2779	D17	Slav Defense: Czech Variation, Krause Attack	1. d4 d5 2. c4 c6 3. Nf3 Nf6 4. Nc3 dxc4 5. a4 Bf5 6. Ne5
2780	D17	Slav Defense: Czech Variation, Krause Attack, Fazekas Gambit	1. d4 d5 2. c4 c6 3. Nf3 Nf6 4. Nc3 dxc4 5. a4 Bf5 6. Ne5 Na6 7. e4
2781	D17	Slav Defense: Czech Variation, Wiesbaden Variation	1. d4 d5 2. c4 c6 3. Nf3 Nf6 4. Nc3 dxc4 5. a4 Bf5 6. Ne5 e6
2782	D17	Slav Defense: Czech Variation, Wiesbaden Variation, Sharp Line	1. d4 d5 2. c4 c6 3. Nf3 Nf6 4. Nc3 dxc4 5. a4 Bf5 6. Ne5 e6 7. f3 Bb4 8. e4
2783	D18	Slav Defense: Czech Variation, Classical System	1. d4 d5 2. c4 c6 3. Nf3 Nf6 4. Nc3 dxc4 5. a4 Bf5 6. e3
2784	D18	Slav Defense: Czech Variation, Lasker Variation	1. d4 d5 2. c4 c6 3. Nf3 Nf6 4. Nc3 dxc4 5. a4 Bf5 6. e3 Na6
2785	D19	Slav Defense: Czech Variation, Classical System, Main Line	1. d4 d5 2. c4 c6 3. Nf3 Nf6 4. Nc3 dxc4 5. a4 Bf5 6. e3 e6 7. Bxc4 Bb4 8. O-O O-O 9. Qe2
2786	D19	Slav Defense: Czech Variation, Dutch Variation	1. d4 d5 2. c4 c6 3. Nf3 Nf6 4. Nc3 dxc4 5. a4 Bf5 6. e3 e6 7. Bxc4 Bb4 8. O-O
2787	D19	Slav Defense: Czech Variation, Dutch Variation, Sämisch Variation	1. d4 d5 2. c4 c6 3. Nf3 Nf6 4. Nc3 dxc4 5. a4 Bf5 6. e3 e6 7. Bxc4 Bb4 8. O-O O-O 9. Qe2 Ne4 10. g4
2788	D20	Queen's Gambit Accepted	1. d4 d5 2. c4 dxc4
2789	D20	Queen's Gambit Accepted: Accelerated Mannheim Variation	1. d4 d5 2. c4 dxc4 3. Qa4+
2790	D20	Queen's Gambit Accepted: Central Variation, Alekhine System	1. d4 d5 2. c4 dxc4 3. e4 Nf6
2791	D20	Queen's Gambit Accepted: Central Variation, Greco Variation	1. d4 d5 2. c4 dxc4 3. e4 b5
2792	D20	Queen's Gambit Accepted: Central Variation, McDonnell Defense	1. d4 d5 2. c4 dxc4 3. e4 e5
2793	D20	Queen's Gambit Accepted: Central Variation, McDonnell Defense, Somov Gambit	1. d4 d5 2. c4 dxc4 3. e4 e5 4. Bxc4
2794	D20	Queen's Gambit Accepted: Central Variation, Modern Defense	1. d4 d5 2. c4 dxc4 3. e4 Nc6
2795	D20	Queen's Gambit Accepted: Central Variation, Rubinstein Defense	1. d4 d5 2. c4 dxc4 3. e4 c5
2796	D20	Queen's Gambit Accepted: Central Variation, Rubinstein Defense, Yefimov Gambit	1. d4 d5 2. c4 dxc4 3. e4 c5 4. d5 b5
2797	D20	Queen's Gambit Accepted: Linares Variation	1. d4 d5 2. c4 dxc4 3. e4 c5 4. d5 Nf6 5. Nc3 b5
2798	D20	Queen's Gambit Accepted: Old Variation	1. d4 d5 2. c4 dxc4 3. e3
2799	D20	Queen's Gambit Accepted: Old Variation, Billinger Gambit	1. d4 d5 2. c4 dxc4 3. e3 e5 4. Bxc4 exd4 5. Qb3 Qe7 6. a3
2800	D20	Queen's Gambit Accepted: Old Variation, Christensen Gambit	1. d4 d5 2. c4 dxc4 3. e3 e5 4. Bxc4 exd4 5. Qb3 Qe7 6. Nf3
2801	D20	Queen's Gambit Accepted: Old Variation, Korchnoi Gambit	1. d4 d5 2. c4 dxc4 3. e3 e5 4. Bxc4 exd4 5. Qb3 Qe7 6. Kf1
2802	D20	Queen's Gambit Accepted: Old Variation, Novikov Gambit	1. d4 d5 2. c4 dxc4 3. e3 e5 4. Bxc4 exd4 5. Qb3 Qe7 6. Nd2
2803	D20	Queen's Gambit Accepted: Saduleto Variation	1. d4 d5 2. c4 dxc4 3. e4
2804	D20	Queen's Gambit Accepted: Schwartz Defense	1. d4 d5 2. c4 dxc4 3. e4 f5
2805	D21	Queen's Gambit Accepted: Alekhine Defense, Borisenko-Furman Variation	1. d4 d5 2. c4 dxc4 3. Nf3 a6 4. e4
2806	D21	Queen's Gambit Accepted: Godes Variation	1. d4 d5 2. c4 dxc4 3. Nf3 Nd7
2807	D21	Queen's Gambit Accepted: Gunsberg Defense	1. d4 d5 2. c4 dxc4 3. Nf3 c5
2808	D21	Queen's Gambit Accepted: Normal Variation	1. d4 d5 2. c4 dxc4 3. Nf3
2809	D21	Queen's Gambit Accepted: Rosenthal Variation	1. d4 d5 2. c4 dxc4 3. Nf3 e6
2810	D21	Queen's Gambit Accepted: Slav Gambit	1. d4 d5 2. c4 dxc4 3. Nf3 b5
2811	D22	Queen's Gambit Accepted: Alekhine Defense	1. d4 d5 2. c4 dxc4 3. Nf3 a6
2812	D22	Queen's Gambit Accepted: Alekhine Defense, Alatortsev Variation	1. d4 d5 2. c4 dxc4 3. Nf3 a6 4. e3 Bg4 5. Bxc4 e6 6. d5
2813	D22	Queen's Gambit Accepted: Alekhine Defense, Haberditz Variation	1. d4 d5 2. c4 dxc4 3. Nf3 a6 4. e3 b5
2814	D23	Queen's Gambit Accepted	1. d4 d5 2. c4 dxc4 3. Nf3 Nf6
2815	D23	Queen's Gambit Accepted: Mannheim Variation	1. d4 d5 2. c4 dxc4 3. Nf3 Nf6 4. Qa4+
2816	D24	Queen's Gambit Accepted: Bogoljubov Defense	1. d4 d5 2. c4 dxc4 3. Nf3 Nf6 4. Nc3 a6 5. e4
2817	D24	Queen's Gambit Accepted: Gunsberg Defense, Prianishenmo Gambit	1. d4 d5 2. c4 dxc4 3. Nf3 Nf6 4. Nc3 c5 5. d5 e6 6. e4 exd5 7. e5
2818	D24	Queen's Gambit Accepted: Showalter Variation	1. d4 d5 2. c4 dxc4 3. Nf3 Nf6 4. Nc3
2819	D25	Queen's Gambit Accepted: Janowski-Larsen Variation	1. d4 d5 2. c4 dxc4 3. Nf3 Nf6 4. e3 Bg4
2820	D25	Queen's Gambit Accepted: Normal Variation	1. d4 d5 2. c4 dxc4 3. Nf3 Nf6 4. e3
2821	D25	Queen's Gambit Accepted: Smyslov Variation	1. d4 d5 2. c4 dxc4 3. Nf3 Nf6 4. e3 g6
2822	D25	Queen's Gambit Accepted: Winawer Defense	1. d4 d5 2. c4 dxc4 3. Nf3 Nf6 4. e3 Be6
2823	D26	Queen's Gambit Accepted: Classical Defense	1. d4 d5 2. c4 dxc4 3. Nf3 Nf6 4. e3 e6 5. Bxc4 c5
2824	D26	Queen's Gambit Accepted: Classical Defense, Normal Line	1. d4 d5 2. c4 dxc4 3. Nf3 Nf6 4. e3 e6 5. Bxc4 c5 6. O-O
2825	D26	Queen's Gambit Accepted: Classical Defense, Steinitz Variation, Development Variation	1. d4 d5 2. c4 dxc4 3. Nf3 Nf6 4. e3 e6 5. Bxc4 c5 6. O-O Nc6
2826	D26	Queen's Gambit Accepted: Classical Defense, Steinitz Variation, Exchange Variation	1. d4 d5 2. c4 dxc4 3. Nf3 Nf6 4. e3 e6 5. Bxc4 c5 6. O-O cxd4
2827	D26	Queen's Gambit Accepted: Classical, Furman Variation	1. d4 d5 2. c4 dxc4 3. Nf3 Nf6 4. e3 e6 5. Bxc4 c5 6. Qe2 a6 7. dxc5 Bxc5 8. O-O Nc6 9. e4 b5 10. e5
2828	D26	Queen's Gambit Accepted: Normal Variation, Traditional System	1. d4 d5 2. c4 dxc4 3. Nf3 Nf6 4. e3 e6
2829	D27	Queen's Gambit Accepted: Classical Defense, Main Line	1. d4 d5 2. c4 dxc4 3. Nf3 Nf6 4. e3 e6 5. Bxc4 c5 6. O-O a6
2830	D27	Queen's Gambit Accepted: Classical Defense, Rubinstein Variation	1. d4 d5 2. c4 dxc4 3. Nf3 Nf6 4. e3 e6 5. Bxc4 c5 6. O-O a6 7. a4
2831	D27	Queen's Gambit Accepted: Classical Defense, Russian Gambit	1. d4 d5 2. c4 dxc4 3. e3 Nf6 4. Bxc4 e6 5. Nf3 c5 6. O-O a6 7. e4
2832	D27	Queen's Gambit Accepted: Furman Variation	1. d4 d5 2. c4 dxc4 3. Nf3 Nf6 4. e3 e6 5. Bxc4 c5 6. O-O a6 7. dxc5 Bxc5
2833	D28	Queen's Gambit Accepted: Classical Defense, Alekhine System	1. d4 d5 2. c4 dxc4 3. Nf3 Nf6 4. e3 e6 5. Bxc4 c5 6. O-O a6 7. Qe2
2834	D28	Queen's Gambit Accepted: Classical Defense, Alekhine System	1. d4 d5 2. c4 dxc4 3. Nf3 Nf6 4. e3 e6 5. Bxc4 c5 6. O-O a6 7. Qe2 b5
2835	D28	Queen's Gambit Accepted: Classical, Flohr Variation	1. d4 d5 2. c4 dxc4 3. Nf3 Nf6 4. e3 e6 5. Bxc4 c5 6. O-O a6 7. Qe2 b5 8. Bb3 Nc6 9. Rd1 c4 10. Bc2 Nb4 11. Nc3 Nxc2 12. Qxc2 Bb7 13. d5 Qc7
2836	D29	Queen's Gambit Accepted: Classical Defense, Alekhine System, Main Line	1. d4 d5 2. c4 dxc4 3. Nf3 Nf6 4. e3 e6 5. Bxc4 c5 6. O-O a6 7. Qe2 b5 8. Bb3 Bb7
2837	D29	Queen's Gambit Accepted: Classical Defense, Alekhine System, Smyslov Variation	1. d4 d5 2. c4 dxc4 3. Nf3 Nf6 4. e3 e6 5. Bxc4 c5 6. O-O a6 7. Qe2 b5 8. Bb3 Bb7 9. Rd1 Nbd7 10. Nc3 Bd6
2838	D30	Queen's Gambit Declined	1. d4 d5 2. c4 e6
2839	D30	Queen's Gambit Declined: Capablanca Variation	1. d4 Nf6 2. c4 e6 3. Nf3 d5 4. Bg5 h6
2840	D30	Queen's Gambit Declined: Capablanca Variation	1. d4 Nf6 2. Nf3 e6 3. c4 d5 4. Bg5 c6 5. Nbd2 Nbd7 6. e3
2841	D30	Queen's Gambit Declined: Semmering Variation	1. d4 d5 2. c4 c6 3. Nf3 Nf6 4. e3 e6 5. Nbd2 Nbd7 6. Bd3 c5
2842	D30	Queen's Gambit Declined: Spielmann Variation	1. d4 d5 2. c4 e6 3. Nf3 Nf6 4. e3 c6 5. Nbd2 g6
2843	D30	Queen's Gambit Declined: Stonewall Variation	1. d4 d5 2. c4 c6 3. Nf3 Nf6 4. e3 e6 5. Nbd2 Ne4 6. Bd3 f5
2844	D30	Queen's Gambit Declined: Tarrasch Defense, Pseudo-Tarrasch	1. d4 d5 2. c4 e6 3. Nf3 c5
2845	D30	Queen's Gambit Declined: Tarrasch Defense, Pseudo-Tarrasch Bishop Attack	1. d4 d5 2. c4 e6 3. Nf3 c5 4. cxd5 exd5 5. Bg5
2846	D30	Queen's Gambit Declined: Traditional Variation	1. d4 Nf6 2. c4 e6 3. Nf3 d5 4. Bg5
