Index	eco	name	pgn
0	A00	Amar Gambit	1. Nh3 d5 2. g3 e5 3. f4 Bxh3 4. Bxh3 exf4
1	A00	Amar Opening	1. Nh3
2	A00	Amar Opening: Gent Gambit	1. Nh3 d5 2. g3 e5 3. f4 Bxh3 4. Bxh3 exf4 5. O-O fxg3 6. hxg3
3	A00	Amar Opening: Paris Gambit	1. Nh3 d5 2. g3 e5 3. f4
4	A00	Amsterdam Attack	1. e3 e5 2. c4 d6 3. Nc3 Nc6 4. b3 Nf6
5	A00	Anderssen's Opening	1. a3
6	A00	Anderssen's Opening: Polish Gambit	1. a3 a5 2. b4
7	A00	Barnes Opening	1. f3
8	A00	Barnes Opening: Fool's Mate	1. f3 e5 2. g4 Qh4#
9	A00	Barnes Opening: Gedult Gambit	1. f3 d5 2. e4 g6 3. d4 dxe4 4. c3
10	A00	Barnes Opening: Gedult Gambit	1. f3 f5 2. e4 fxe4 3. Nc3
11	A00	Barnes Opening: Hammerschlag	1. f3 e5 2. Kf2
12	A00	Clemenz Opening	1. h3
13	A00	Clemenz Opening: Spike Lee Gambit	1. h3 h5 2. g4
14	A00	Crab Opening	1. a4 e5 2. h4
15	A00	Creepy Crawly Formation: Classical Defense	1. h3 d5 2. a3 e5
16	A00	Formation: Hippopotamus Attack	1. a3 e5 2. b3 d5 3. c3 Nf6 4. d3 Nc6 5. e3 Bd6 6. f3 O-O 7. g3
17	A00	Formation: Shy Attack	1. a3 e5 2. g3 d5 3. Bg2 Nf6 4. d3 Nc6 5. Nd2 Bd6 6. e3 O-O 7. h3
18	A00	Global Opening	1. h3 e5 2. a3
19	A00	Grob Opening	1. g4
20	A00	Grob Opening: Alessi Gambit	1. g4 f5
21	A00	Grob Opening: Double Grob	1. g4 g5
22	A00	Grob Opening: Double Grob, Coca-Cola Gambit	1. g4 g5 2. f4
23	A00	Grob Opening: Grob Gambit	1. g4 d5 2. Bg2
24	A00	Grob Opening: Grob Gambit Declined	1. g4 d5 2. Bg2 c6
25	A00	Grob Opening: Grob Gambit, Basman Gambit	1. g4 d5 2. Bg2 h5 3. gxh5
26	A00	Grob Opening: Grob Gambit, Fritz Gambit	1. g4 d5 2. Bg2 Bxg4 3. c4
27	A00	Grob Opening: Grob Gambit, Fritz Gambit, Romford Countergambit	1. g4 d5 2. Bg2 Bxg4 3. c4 d4 4. Bxb7 Nd7 5. Bxa8 Qxa8
28	A00	Grob Opening: Grob Gambit, Keres Gambit	1. g4 d5 2. Bg2 e5 3. d4 exd4 4. c3
29	A00	Grob Opening: Grob Gambit, Richter-Grob Gambit	1. g4 d5 2. Bg2 c6 3. c4 dxc4 4. b3
30	A00	Grob Opening: Keene Defense	1. g4 d5 2. h3 e5 3. Bg2 c6
31	A00	Grob Opening: Keene Defense, Main Line	1. g4 d5 2. h3 e5 3. Bg2 c6 4. d4 e4 5. c4 Bd6 6. Nc3 Ne7
32	A00	Grob Opening: London Defense	1. g4 e5 2. h3 Nc6
33	A00	Grob Opening: Romford Countergambit	1. g4 d5 2. Bg2 Bxg4 3. c4 d4
34	A00	Grob Opening: Spike Attack	1. g4 d5 2. Bg2 c6 3. g5
35	A00	Grob Opening: Spike, Hurst Attack	1. g4 e5 2. Bg2 d5 3. c4
36	A00	Grob Opening: Zilbermints Gambit	1. g4 d5 2. e4 dxe4 3. Nc3
37	A00	Grob Opening: Zilbermints Gambit, Schiller Defense	1. g4 d5 2. e4 dxe4 3. Nc3 h5
38	A00	Grob Opening: Zilbermints Gambit, Zilbermints-Hartlaub Gambit	1. g4 d5 2. e4 dxe4 3. Nc3 e5 4. d3
39	A00	Hungarian Opening	1. g3
40	A00	Hungarian Opening: Asten Gambit	1. g3 Nc6 2. Nc3 d5 3. d4 e5 4. dxe5 d4 5. Ne4 f5
41	A00	Hungarian Opening: Burk Gambit	1. g3 e5 2. a3 d5 3. Nf3 e4 4. Nh4 Be7 5. d3
42	A00	Hungarian Opening: Bücker Gambit	1. g3 d5 2. Bg2 e5 3. b4
43	A00	Hungarian Opening: Catalan Formation	1. g3 d5 2. Bg2 e6
44	A00	Hungarian Opening: Dutch Defense	1. g3 f5
45	A00	Hungarian Opening: Indian Defense	1. g3 Nf6
46	A00	Hungarian Opening: Myers Defense	1. g3 g5
47	A00	Hungarian Opening: Pachman Gambit	1. g3 f5 2. e4 fxe4 3. Qh5+ g6
48	A00	Hungarian Opening: Paris Gambit	1. g3 e5 2. Nh3 d5 3. f4 Bxh3 4. Bxh3 exf4 5. O-O
49	A00	Hungarian Opening: Reversed Alekhine	1. g3 e5 2. Nf3
50	A00	Hungarian Opening: Reversed Brooklyn Defense, Brooklyn Benko Gambit	1. g3 e5 2. Nf3 e4 3. Ng1 Nf6 4. b4
51	A00	Hungarian Opening: Reversed Modern Defense	1. g3 d5 2. Bg2 c5
52	A00	Hungarian Opening: Reversed Norwegian Defense	1. g3 e5 2. Nf3 e4 3. Nh4
53	A00	Hungarian Opening: Sicilian Invitation	1. g3 c5
54	A00	Hungarian Opening: Slav Formation	1. g3 d5 2. Bg2 c6
55	A00	Hungarian Opening: Symmetrical Variation	1. g3 g6
56	A00	Hungarian Opening: Van Kuijk Gambit	1. g3 h5 2. Nf3 h4
57	A00	Hungarian Opening: Winterberg Gambit	1. g3 d5 2. Bg2 e5 3. c4 dxc4 4. b3
58	A00	Kádas Opening	1. h4
59	A00	Kádas Opening: Beginner's Trap	1. h4 d5 2. Rh3
60	A00	Kádas Opening: Kádas Gambit	1. h4 c5 2. b4
61	A00	Kádas Opening: Kádas Gambit	1. h4 d5 2. d4 c5 3. Nf3 cxd4 4. c3
62	A00	Kádas Opening: Kádas Gambit	1. h4 e5 2. d4 exd4 3. c3
63	A00	Kádas Opening: Myers Variation	1. h4 d5 2. d4 c5 3. e4
64	A00	Kádas Opening: Schneider Gambit	1. h4 g5
65	A00	Kádas Opening: Steinbok Gambit	1. h4 f5 2. e4 fxe4 3. d3
66	A00	Lasker Simul Special	1. g3 h5
67	A00	Mieses Opening	1. d3
68	A00	Mieses Opening: Myers Spike Attack	1. d3 g6 2. g4
69	A00	Mieses Opening: Reversed Rat	1. d3 e5
70	A00	Polish Opening	1. b4
71	A00	Polish Opening: Baltic Defense	1. b4 d5 2. Bb2 Bf5
72	A00	Polish Opening: Birmingham Gambit	1. b4 c5
73	A00	Polish Opening: Bugayev Advance Variation	1. b4 e5 2. Bb2 f6 3. b5
74	A00	Polish Opening: Bugayev Attack	1. b4 e5 2. a3
75	A00	Polish Opening: Czech Defense	1. b4 e5 2. Bb2 d6
76	A00	Polish Opening: Dutch Defense	1. b4 f5
77	A00	Polish Opening: German Defense	1. b4 d5 2. Bb2 Qd6
78	A00	Polish Opening: Grigorian Variation	1. b4 Nc6
79	A00	Polish Opening: Karniewski Variation	1. b4 Nh6
80	A00	Polish Opening: King's Indian Variation	1. b4 Nf6 2. Bb2 g6
81	A00	Polish Opening: King's Indian Variation, Schiffler Attack	1. b4 Nf6 2. Bb2 g6 3. e4
82	A00	Polish Opening: King's Indian Variation, Sokolsky Attack	1. b4 Nf6 2. Bb2 g6 3. c4 Bg7 4. e3 d6 5. Nf3 O-O 6. d4
83	A00	Polish Opening: Myers Variation	1. b4 d5 2. Bb2 c6 3. a4
84	A00	Polish Opening: Outflank Variation	1. b4 c6
85	A00	Polish Opening: Queen's Indian Variation	1. b4 e6 2. Bb2 Nf6 3. b5 b6
86	A00	Polish Opening: Queenside Defense	1. b4 e6 2. Bb2 Nf6 3. b5 a6
87	A00	Polish Opening: Rooks Swap Line	1. b4 e6 2. Bb2 Nf6 3. b5 a6 4. a4 axb5 5. axb5 Rxa1 6. Bxa1
88	A00	Polish Opening: Schiffler-Sokolsky Variation	1. b4 e6 2. Bb2 Nf6 3. b5 d5 4. e3
89	A00	Polish Opening: Schuehler Gambit	1. b4 c6 2. Bb2 a5 3. b5 cxb5 4. e4
90	A00	Polish Opening: Symmetrical Variation	1. b4 b5
91	A00	Polish Opening: Tartakower Gambit	1. b4 e5 2. Bb2 f6 3. e4
92	A00	Polish Opening: Wolferts Gambit	1. b4 e5 2. Bb2 c5
93	A00	Saragossa Opening	1. c3
94	A00	Sodium Attack	1. Na3
95	A00	Sodium Attack: Chenoboskion Variation	1. Na3 g6 2. g4
96	A00	Sodium Attack: Durkin Gambit	1. Na3 e5 2. Nc4 Nc6 3. e4 f5
97	A00	Valencia Opening	1. d3 e5 2. Nd2
98	A00	Van Geet Opening	1. Nc3
99	A00	Van Geet Opening: Battambang Variation	1. a3 e5 2. Nc3
100	A00	Van Geet Opening: Billockus-Johansen Gambit	1. Nc3 e5 2. Nf3 Bc5
101	A00	Van Geet Opening: Caro-Kann Variation, St. Patrick's Attack	1. Nc3 d5 2. e4 c6 3. h3
102	A00	Van Geet Opening: Damhaug Gambit	1. Nc3 d5 2. f4 e5
103	A00	Van Geet Opening: Dougherty Gambit	1. Nc3 d5 2. e4 dxe4 3. f3
104	A00	Van Geet Opening: Dunst-Perrenet Gambit	1. Nc3 d5 2. e4 dxe4 3. d3
105	A00	Van Geet Opening: Düsseldorf Gambit	1. Nc3 c5 2. b4
106	A00	Van Geet Opening: Gladbacher Gambit	1. Nc3 e5 2. b3 d5 3. e4 dxe4 4. d3
107	A00	Van Geet Opening: Hector Gambit	1. Nc3 d5 2. e4 dxe4 3. Bc4
108	A00	Van Geet Opening: Hergert Gambit	1. Nc3 d6 2. f4 e5 3. fxe5 Nc6
109	A00	Van Geet Opening: Hulsemann Gambit	1. Nc3 e5 2. e3 d5 3. Qh5 Be6
110	A00	Van Geet Opening: Jendrossek Gambit	1. Nc3 d5 2. f4 d4 3. Ne4 f5 4. Nf2 Nf6 5. Nf3 c5 6. b4
111	A00	Van Geet Opening: Kluever Gambit	1. Nc3 f5 2. e4 fxe4 3. d3
112	A00	Van Geet Opening: Laroche Gambit	1. Nc3 b5
113	A00	Van Geet Opening: Liebig Gambit	1. Nc3 e5 2. e3 d5 3. Qh5 Nf6
114	A00	Van Geet Opening: Melleby Gambit	1. Nc3 d5 2. f4 d4 3. Ne4 c5
115	A00	Van Geet Opening: Myers Attack	1. Nc3 g6 2. h4
116	A00	Van Geet Opening: Napoleon Attack	1. Nc3 e5 2. Nf3 Nc6 3. d4
117	A00	Van Geet Opening: Novosibirsk Variation	1. Nc3 c5 2. d4 cxd4 3. Qxd4 Nc6 4. Qh4
118	A00	Van Geet Opening: Nowokunski Gambit	1. Nc3 e5 2. f4 exf4 3. e4
119	A00	Van Geet Opening: Pfeiffer Gambit	1. Nc3 d5 2. f4 d4 3. Ne4 e5
120	A00	Van Geet Opening: Pfeiffer Gambit, Sleipnir Countergambit	1. Nc3 d5 2. f4 d4 3. Ne4 e5 4. Nf3
121	A00	Van Geet Opening: Reversed Nimzowitsch	1. Nc3 e5
122	A00	Van Geet Opening: Reversed Scandinavian	1. Nc3 e5 2. d4 exd4 3. Qxd4 Nc6 4. Qa4
123	A00	Van Geet Opening: Sicilian Two Knights	1. Nc3 c5 2. Nf3 Nc6 3. d4 cxd4 4. Nxd4
124	A00	Van Geet Opening: Sleipnir Gambit	1. Nc3 d5 2. e3 e5 3. d4 Bb4
125	A00	Van Geet Opening: Twyble Attack	1. Nc3 c5 2. Rb1
126	A00	Van Geet Opening: Tübingen Gambit	1. Nc3 Nf6 2. g4
127	A00	Van Geet Opening: Venezolana Variation	1. Nc3 d5 2. d3 Nf6 3. g3
128	A00	Van Geet Opening: Warsteiner Gambit	1. Nc3 d5 2. f4 g5
129	A00	Van't Kruijs Opening	1. e3
130	A00	Van't Kruijs Opening: Bouncing Bishop Variation	1. e3 e5 2. Bc4 b5 3. Bb3
131	A00	Van't Kruijs Opening: Keoni-Hiva Gambit, Akahi Variation	1. e3 e5 2. Nc3 Nf6 3. f4 exf4 4. Nf3
132	A00	Van't Kruijs Opening: Keoni-Hiva Gambit, Alua Variation	1. e3 e5 2. Nc3 Nc6 3. f4 exf4 4. Nf3
133	A00	Van't Kruijs Opening: Keoni-Hiva Gambit, Ekolu Variation	1. e3 e5 2. Nc3 d5 3. f4 exf4 4. Nf3
134	A00	Venezolana Opening	1. d3 c5 2. Nc3 Nc6 3. g3
135	A00	Ware Opening	1. a4
136	A00	Ware Opening: Meadow Hay Trap	1. a4 e5 2. Ra3
137	A00	Ware Opening: Ware Gambit	1. a4 e5 2. a5 d5 3. e3 f5 4. a6
138	A00	Ware Opening: Wing Gambit	1. a4 b5 2. axb5 Bb7
139	A01	Nimzo-Larsen Attack	1. b3
140	A01	Nimzo-Larsen Attack: Classical Variation	1. b3 d5
141	A01	Nimzo-Larsen Attack: Dutch Variation	1. b3 f5
142	A01	Nimzo-Larsen Attack: English Variation	1. b3 c5
143	A01	Nimzo-Larsen Attack: Graz Attack	1. b3 d5 2. Ba3
144	A01	Nimzo-Larsen Attack: Indian Variation	1. b3 Nf6
145	A01	Nimzo-Larsen Attack: Modern Variation	1. b3 e5
146	A01	Nimzo-Larsen Attack: Modern Variation	1. b3 e5 2. Bb2 Nc6
147	A01	Nimzo-Larsen Attack: Modern Variation	1. b3 e5 2. Bb2 Nc6 3. e3
148	A01	Nimzo-Larsen Attack: Pachman Gambit	1. b3 e5 2. Bb2 Nc6 3. f4
149	A01	Nimzo-Larsen Attack: Polish Variation	1. b3 b5
150	A01	Nimzo-Larsen Attack: Ringelbach Gambit	1. b3 f5 2. Bb2 e6 3. e4
151	A01	Nimzo-Larsen Attack: Spike Variation	1. b3 Nf6 2. Bb2 g6 3. g4
152	A01	Nimzo-Larsen Attack: Symmetrical Variation	1. b3 b6
153	A02	Bird Opening	1. f4
154	A02	Bird Opening	1. f4 Nf6
155	A02	Bird Opening: Batavo-Polish Attack	1. f4 Nf6 2. Nf3 g6 3. b4
156	A02	Bird Opening: Double Duck Formation	1. f4 f5 2. d4 d5
157	A02	Bird Opening: From's Gambit	1. f4 e5
158	A02	Bird Opening: From's Gambit, Bahr Gambit	1. f4 e5 2. Nc3
159	A02	Bird Opening: From's Gambit, Langheld Gambit	1. f4 e5 2. fxe5 d6 3. exd6 Nf6
160	A02	Bird Opening: From's Gambit, Lasker Variation	1. f4 e5 2. fxe5 d6 3. exd6 Bxd6 4. Nf3 g5
161	A02	Bird Opening: From's Gambit, Lipke Variation	1. f4 e5 2. fxe5 d6 3. exd6 Bxd6 4. Nf3 Nh6 5. d4
162	A02	Bird Opening: Hobbs Gambit	1. f4 g5
163	A02	Bird Opening: Hobbs-Zilbermints Gambit	1. f4 h6 2. Nf3 g5
164	A02	Bird Opening: Horsefly Defense	1. f4 Nh6
165	A02	Bird Opening: Lasker Gambit	1. f4 e5 2. fxe5 f6
166	A02	Bird Opening: Mujannah	1. f4 Nf6 2. c4
167	A02	Bird Opening: Myers Defense	1. f4 b5
168	A02	Bird Opening: Platz Gambit	1. f4 e5 2. fxe5 Ne7
169	A02	Bird Opening: Schlechter Gambit	1. f4 e5 2. fxe5 Nc6
170	A02	Bird Opening: Siegener Gambit	1. f4 e5 2. d4 exd4 3. Nf3 c5 4. c3
171	A02	Bird Opening: Swiss Gambit	1. f4 f5 2. e4 fxe4 3. Nc3 Nf6 4. g4
172	A02	Bird Opening: Wagner-Zwitersch Gambit	1. f4 f5 2. e4
173	A03	Bird Opening: Dutch Variation	1. f4 d5
174	A03	Bird Opening: Dutch Variation, Dudweiler Gambit	1. f4 d5 2. g4
175	A03	Bird Opening: Lasker Variation	1. f4 d5 2. Nf3 Nf6 3. e3 c5
176	A03	Bird Opening: Sturm Gambit	1. f4 d5 2. c4
177	A03	Bird Opening: Thomas Gambit	1. f4 d5 2. b3 Nf6 3. Bb2 d4 4. Nf3 c5 5. e3
178	A03	Bird Opening: Williams Gambit	1. f4 d5 2. e4
179	A03	Bird Opening: Williams Gambit	1. f4 d5 2. e4 dxe4 3. Nc3 Nf6 4. Qe2
180	A03	Bird Opening: Williams-Zilbermints Gambit	1. f4 d5 2. e4 dxe4 3. Nc3 Nf6 4. Nge2
181	A04	Colle System: Rhamphorhynchus Variation	1. Nf3 c5 2. e3 g6 3. d4 Bg7 4. dxc5 Qa5+
182	A04	Modern Defense: Semi-Averbakh Variation, Polish Variation	1. Nf3 c5 2. c4 g6 3. d4 Bg7 4. e4 Qb6
183	A04	Modern Defense: Semi-Averbakh Variation, Pterodactyl Variation	1. Nf3 c5 2. c4 g6 3. d4 Bg7 4. e4 Qa5+
184	A04	Modern Defense: Semi-Averbakh Variation, Pterodactyl Variation Accepted	1. Nf3 g6 2. d4 Bg7 3. e4 d6 4. c4 c5 5. dxc5 Qa5+
185	A04	Zukertort Defense: Kingside Variation	1. Nf3 Nh6 2. d4 g6
186	A04	Zukertort Defense: Sicilian Knight Variation	1. Nf3 Na6 2. e4 c5
187	A04	Zukertort Opening	1. Nf3
188	A04	Zukertort Opening: Arctic Defense	1. Nf3 f6
189	A04	Zukertort Opening: Arctic Defense, Drunken Knight Variation	1. Nf3 f6 2. e4 Nh6 3. d4 Nf7
190	A04	Zukertort Opening: Basman Defense	1. Nf3 h6
191	A04	Zukertort Opening: Black Mustang Defense	1. Nf3 Nc6
192	A04	Zukertort Opening: Drunken Cavalry Variation	1. Nf3 Na6 2. e4 Nh6
193	A04	Zukertort Opening: Dutch Variation	1. Nf3 f5
194	A04	Zukertort Opening: Herrstrom Gambit	1. Nf3 g5
195	A04	Zukertort Opening: Kingside Fianchetto	1. Nf3 g6
196	A04	Zukertort Opening: Lisitsyn Gambit	1. Nf3 f5 2. e4
197	A04	Zukertort Opening: Lisitsyn Gambit Deferred	1. Nf3 f5 2. d3 Nf6 3. e4
198	A04	Zukertort Opening: Pirc Invitation	1. Nf3 d6
199	A04	Zukertort Opening: Polish Defense	1. Nf3 b5
200	A04	Zukertort Opening: Queen's Gambit Invitation	1. Nf3 e6
201	A04	Zukertort Opening: Queenside Fianchetto Variation	1. Nf3 b6
202	A04	Zukertort Opening: Ross Gambit	1. Nf3 e5
203	A04	Zukertort Opening: Shabalov Gambit	1. Nf3 e6 2. c4 a6 3. Nc3 c5 4. g3 b5
204	A04	Zukertort Opening: Sicilian Invitation	1. Nf3 c5
205	A04	Zukertort Opening: Slav Invitation	1. Nf3 c6
206	A04	Zukertort Opening: Speelsmet Gambit	1. Nf3 c5 2. d4 cxd4 3. e3
207	A04	Zukertort Opening: St. George Defense	1. Nf3 a6
208	A04	Zukertort Opening: The Walrus	1. Nf3 e5 2. Nxe5 Nc6 3. Nxc6 dxc6
209	A04	Zukertort Opening: Vos Gambit	1. Nf3 d6 2. d4 e5
210	A04	Zukertort Opening: Wade Defense	1. Nf3 d6 2. e4 Bg4
211	A04	Zukertort Opening: Ware Defense	1. Nf3 a5
212	A05	King's Indian Attack	1. Nf3 Nf6 2. g3 d5
213	A05	King's Indian Attack: Smyslov Variation	1. Nf3 Nf6 2. g3 g6 3. b4
214	A05	King's Indian Attack: Spassky Variation	1. Nf3 Nf6 2. g3 b5
215	A05	King's Indian Attack: Symmetrical Defense	1. Nf3 Nf6 2. g3 g6
216	A05	King's Indian Attack: Wahls Defense	1. Nf3 Nf6 2. g3 g6 3. Bg2 Bg7 4. O-O O-O 5. d3 d5
217	A05	Polish Opening: Zukertort System	1. Nf3 Nf6 2. b4
218	A05	Zukertort Opening	1. Nf3 Nf6
219	A05	Zukertort Opening	1. Nf3 Nf6 2. Nc3 Nc6
220	A05	Zukertort Opening: Double Fianchetto Attack	1. Nf3 Nf6 2. g3 g6 3. b3 Bg7 4. Bb2 O-O 5. Bg2 d6 6. O-O
221	A05	Zukertort Opening: Lemberger Gambit	1. Nf3 Nf6 2. e4
222	A05	Zukertort Opening: Myers Polish Attack	1. Nf3 Nf6 2. a4 g6 3. b4
223	A05	Zukertort Opening: Nimzo-Larsen Variation	1. Nf3 Nf6 2. b3
224	A05	Zukertort Opening: Quiet System	1. Nf3 Nf6 2. e3
225	A06	Nimzo-Larsen Attack: Classical Variation	1. Nf3 d5 2. b3
226	A06	Nimzo-Larsen Attack: Norfolk Gambit	1. Nf3 d5 2. b3 c5 3. e4
227	A06	Nimzo-Larsen Attack: Norfolk Gambit	1. Nf3 d5 2. b3 Nf6 3. Bb2 c5 4. e4
228	A06	Zukertort Opening	1. Nf3 d5
229	A06	Zukertort Opening: Ampel Variation	1. Nf3 d5 2. Rg1
230	A06	Zukertort Opening: Old Indian Attack	1. Nf3 d5 2. d3
231	A06	Zukertort Opening: Pachman Gambit	1. Nf3 d5 2. e3 c5 3. c4 dxc4 4. b3
232	A06	Zukertort Opening: Regina-Nu Gambit	1. Nf3 d5 2. b3 c5 3. c4 dxc4 4. Nc3
233	A06	Zukertort Opening: Reversed Mexican Defense	1. Nf3 d5 2. Nc3
234	A06	Zukertort Opening: Santasiere's Folly	1. b4 d5 2. Nf3
235	A06	Zukertort Opening: Tennison Gambit	1. e4 d5 2. Nf3
236	A06	Zukertort Opening: The Potato	1. Nf3 d5 2. a4
237	A07	Hungarian Opening: Wiedenhagen-Beta Gambit	1. g3 d5 2. Nf3 g5
238	A07	King's Indian Attack	1. Nf3 d5 2. g3
239	A07	King's Indian Attack: Double Fianchetto	1. Nf3 d5 2. g3 g6
240	A07	King's Indian Attack: Keres Variation	1. Nf3 d5 2. g3 Bg4
241	A07	King's Indian Attack: Keres Variation	1. Nf3 d5 2. g3 Bg4 3. Bg2 Nd7
242	A07	King's Indian Attack: Omega-Delta Gambit	1. Nf3 d5 2. g3 e5
243	A07	King's Indian Attack: Pachman System	1. Nf3 d5 2. g3 g6 3. Bg2 Bg7 4. O-O e5 5. d3 Ne7
244	A07	King's Indian Attack: Sicilian Variation	1. Nf3 d5 2. g3 c5
245	A07	King's Indian Attack: Yugoslav Variation	1. Nf3 Nf6 2. g3 d5 3. Bg2 c6 4. O-O Bg4
246	A08	King's Indian Attack: French Variation	1. Nf3 d5 2. g3 c5 3. Bg2 Nc6
247	A08	King's Indian Attack: Sicilian Variation	1. e4 e6 2. d3 d5 3. Nd2 Nf6 4. Ngf3 c5 5. g3 Nc6 6. Bg2 Be7 7. O-O O-O 8. Re1
248	A08	King's Indian Attack: Sicilian Variation	1. Nf3 d5 2. g3 c5 3. Bg2
249	A08	Zukertort Opening: Grünfeld Reversed	1. Nf3 d5 2. g3 c5 3. Bg2 Nc6 4. d4 e6 5. O-O
250	A09	Réti Opening	1. Nf3 d5 2. c4
251	A09	Réti Opening: Advance Variation	1. Nf3 d5 2. c4 d4
252	A09	Réti Opening: Advance Variation, Michel Gambit	1. Nf3 d5 2. c4 d4 3. b4 c5
253	A09	Réti Opening: Penguin Variation	1. Nf3 d5 2. c4 d4 3. Rg1
254	A09	Réti Opening: Reversed Blumenfeld Gambit	1. Nf3 d5 2. c4 d4 3. e3 c5 4. b4
255	A09	Réti Opening: Réti Accepted	1. Nf3 d5 2. c4 dxc4
256	A09	Réti Opening: Réti Gambit, Keres Variation	1. Nf3 d5 2. c4 dxc4 3. e3 Be6
257	A09	Réti Opening: Zilbermints Gambit	1. Nf3 d5 2. c4 b5
258	A10	English Opening	1. c4
259	A10	English Opening: Achilles-Omega Gambit	1. c4 Nf6 2. e4
260	A10	English Opening: Adorjan Defense	1. c4 g6 2. e4 e5
261	A10	English Opening: Anglo-Dutch Defense	1. c4 f5
262	A10	English Opening: Anglo-Dutch Defense, Hickmann Gambit	1. c4 f5 2. e4
263	A10	English Opening: Anglo-Dutch Variation, Chabanon Gambit	1. c4 f5 2. Nf3 d6 3. e4
264	A10	English Opening: Anglo-Dutch Variation, Ferenc Gambit	1. c4 f5 2. Nc3 Nf6 3. e4
265	A10	English Opening: Anglo-Lithuanian Variation	1. c4 Nc6
266	A10	English Opening: Anglo-Scandinavian Defense	1. c4 d5
267	A10	English Opening: Anglo-Scandinavian Defense, Löhn Gambit	1. c4 d5 2. cxd5 e6
268	A10	English Opening: Anglo-Scandinavian Defense, Malvinas Variation	1. c4 d5 2. cxd5 Qxd5 3. Nc3 Qa5
269	A10	English Opening: Anglo-Scandinavian Defense, Schulz Gambit	1. c4 d5 2. cxd5 Nf6
270	A10	English Opening: Great Snake Variation	1. c4 g6
271	A10	English Opening: Jaenisch Gambit	1. c4 b5
272	A10	English Opening: King's English Variation, Botvinnik System, Prickly Pawn Pass System	1. c4 g6 2. Nc3 Bg7 3. g3 Nf6 4. Bg2 O-O 5. e4 d6 6. Nge2 e5 7. O-O c6 8. d3 a6
273	A10	English Opening: Myers Defense	1. c4 g5
274	A10	English Opening: Myers Gambit	1. c4 g5 2. d4 Bg7
275	A10	English Opening: Porcupine Variation	1. c4 f5 2. Nc3 Nf6 3. e4 fxe4 4. g4
276	A10	English Opening: Wade Gambit	1. c4 f5 2. g4
277	A10	English Opening: Zilbermints Gambit	1. c4 g5 2. d4 e5
278	A11	English Opening: Caro-Kann Defensive System	1. c4 c6
279	A12	Réti Opening: Anglo-Slav Variation, Bled Variation	1. Nf3 d5 2. b3 Nf6 3. Bb2 g6 4. c4 c6
280	A12	Réti Opening: Anglo-Slav Variation, Bogoljubov Variation	1. Nf3 d5 2. c4 c6 3. b3
281	A12	Réti Opening: Anglo-Slav Variation, Bogoljubov Variation	1. Nf3 d5 2. c4 c6 3. b3 Bg4
282	A12	Réti Opening: Anglo-Slav Variation, Bogoljubov Variation	1. Nf3 Nf6 2. c4 c6 3. b3 d5 4. Bb2
283	A12	Réti Opening: Anglo-Slav Variation, Capablanca Variation	1. c4 Nf6 2. Nf3 c6 3. b3 d5 4. Bb2 Bg4
284	A12	Réti Opening: Anglo-Slav Variation, London Defensive System	1. c4 Nf6 2. g3 c6 3. Nf3 d5 4. b3 Bf5
285	A12	Réti Opening: Anglo-Slav Variation, New York System	1. Nf3 Nf6 2. c4 c6 3. b3 d5 4. Bb2 Bf5
286	A12	Réti Opening: Anglo-Slav Variation, Torre System	1. c4 Nf6 2. g3 c6 3. Nf3 d5 4. b3 Bg4
287	A13	English Opening: Agincourt Defense	1. c4 e6
288	A13	English Opening: Agincourt Defense	1. c4 e6 2. Nf3
289	A13	English Opening: Agincourt Defense	1. c4 e6 2. Nf3 d5
290	A13	English Opening: Agincourt Defense, Bogoljubov Defense	1. Nf3 Nf6 2. c4 e6 3. g3 d5 4. Bg2 Bd6
291	A13	English Opening: Agincourt Defense, Catalan Defense	1. Nf3 d5 2. c4 e6 3. g3 b6 4. Bg2 Bb7 5. O-O
292	A13	English Opening: Agincourt Defense, Catalan Defense	1. Nf3 d5 2. c4 e6 3. g3 c5
293	A13	English Opening: Agincourt Defense, Catalan Defense Accepted	1. Nf3 Nf6 2. c4 e6 3. g3 d5 4. Bg2 dxc4
294	A13	English Opening: Agincourt Defense, Catalan Defense, Semi-Slav Defense	1. Nf3 Nf6 2. c4 e6 3. g3 d5 4. Bg2 c6
295	A13	English Opening: Agincourt Defense, Kurajica Defense	1. Nf3 d5 2. c4 e6 3. g3 c6
296	A13	English Opening: Agincourt Defense, Tarrasch Defense	1. Nf3 Nf6 2. c4 e6 3. g3 d5 4. b3 c5 5. Bg2 Nc6 6. O-O Be7
297	A13	English Opening: Agincourt Defense, Wimpy System	1. Nf3 Nf6 2. c4 e6 3. b3 d5 4. Bb2 c5 5. e3
298	A13	English Opening: Neo-Catalan	1. Nf3 Nf6 2. c4 e6 3. g3 d5
299	A13	English Opening: Neo-Catalan Declined	1. Nf3 Nf6 2. c4 e6 3. g3 d5 4. Bg2 Be7
300	A13	English Opening: Romanishin Gambit	1. Nf3 Nf6 2. c4 e6 3. g3 a6 4. Bg2 b5
301	A14	English Opening: Agincourt Defense, Keres Defense	1. c4 c5 2. Nf3 Nf6 3. Nc3 e6 4. g3 d5 5. cxd5 Nxd5 6. Bg2 Nc6 7. O-O Be7
302	A14	English Opening: Agincourt Defense, Neo-Catalan Declined	1. Nf3 Nf6 2. c4 e6 3. g3 d5 4. Bg2 Be7 5. O-O
303	A14	Réti Opening: Anglo-Slav Variation, Bogoljubov Variation, Stonewall Line	1. Nf3 d5 2. c4 e6 3. g3 Nf6 4. Bg2 Be7 5. O-O O-O 6. b3 c6 7. Bb2
304	A15	English Opening: Anglo-Indian Defense	1. c4 Nf6
305	A15	English Opening: Anglo-Indian Defense, Anti-Anti-Grünfeld	1. Nf3 Nf6 2. c4 g6 3. Nc3 Bg7 4. e4
306	A15	English Opening: Anglo-Indian Defense, Grünfeld Formation	1. c4 Nf6 2. Nf3 g6 3. g3 d5
307	A15	English Opening: Anglo-Indian Defense, King's Indian Formation	1. Nf3 Nf6 2. c4 g6
308	A15	English Opening: Anglo-Indian Defense, King's Indian Formation, Double Fianchetto	1. Nf3 Nf6 2. c4 b6 3. g3 Bb7 4. Bg2 g6
309	A15	English Opening: Anglo-Indian Defense, King's Knight Variation	1. Nf3 Nf6 2. c4
310	A15	English Opening: Anglo-Indian Defense, Old Indian Formation	1. Nf3 Nf6 2. c4 d6
311	A15	English Opening: Anglo-Indian Defense, Queen's Indian Formation	1. Nf3 Nf6 2. c4 b6
312	A15	English Opening: Anglo-Indian Defense, Queen's Indian Formation	1. Nf3 Nf6 2. c4 e6 3. g3 b6 4. Bg2 Bb7
313	A15	English Opening: Anglo-Indian Defense, Romanishin Variation	1. Nf3 Nf6 2. c4 e6 3. g3 a6
314	A15	English Opening: Anglo-Indian Defense, Scandinavian Defense	1. Nf3 Nf6 2. c4 d5
315	A15	English Opening: Anglo-Indian Defense, Scandinavian Defense, Exchange Variation	1. Nf3 Nf6 2. c4 d5 3. cxd5 Nxd5
316	A15	English Opening: Anglo-Indian Defense, Slav Formation	1. Nf3 Nf6 2. c4 g6 3. g3 c6
317	A15	English Orangutan	1. c4 Nf6 2. b4
318	A16	English Opening: Anglo-Grünfeld Defense	1. c4 Nf6 2. Nc3 d5
319	A16	English Opening: Anglo-Grünfeld Defense, Korchnoi Variation	1. Nf3 Nf6 2. c4 g6 3. Nc3 d5 4. cxd5 Nxd5 5. g3 Bg7 6. Bg2 e5
320	A16	English Opening: Anglo-Indian Defense, Anglo-Grünfeld Variation	1. c4 Nf6 2. Nc3 d5 3. cxd5 Nxd5 4. Nf3
321	A16	English Opening: Anglo-Indian Defense, Anglo-Grünfeld Variation	1. c4 Nf6 2. Nc3 d5 3. cxd5 Nxd5 4. g3 g6 5. Bg2 Nb6
322	A16	English Opening: Anglo-Indian Defense, Anglo-Grünfeld Variation	1. c4 Nf6 2. Nc3 d5 3. cxd5 Nxd5 4. g3 g6 5. Bg2 Nxc3
323	A16	English Opening: Anglo-Indian Defense, Queen's Knight Variation	1. c4 Nf6 2. Nc3
324	A17	English Opening: Anglo-Indian Defense, Hedgehog System	1. c4 Nf6 2. Nc3 e6
325	A17	English Opening: Anglo-Indian Defense, Nimzo-English	1. Nf3 Nf6 2. c4 e6 3. Nc3 Bb4
326	A17	English Opening: Anglo-Indian Defense, Queen's Indian Formation	1. c4 Nf6 2. Nc3 e6 3. Nf3 b6
327	A17	English Opening: Anglo-Indian Defense, Queen's Indian Variation	1. c4 Nf6 2. Nc3 e6 3. Nf3 b6 4. e4 Bb7 5. Bd3
328	A17	English Opening: Anglo-Indian Defense, Zvjaginsev-Krasenkow Attack	1. c4 Nf6 2. Nc3 e6 3. Nf3 Bb4 4. g4
329	A18	English Opening: Mikenas-Carls Variation	1. c4 Nf6 2. Nc3 e6 3. e4
330	A18	English Opening: Mikenas-Carls Variation	1. c4 Nf6 2. Nc3 e6 3. e4 Nc6
331	A18	English Opening: Mikenas-Carls Variation	1. c4 Nf6 2. Nc3 e6 3. e4 d5 4. e5
332	A19	English Opening: Anglo-Indian Defense, Flohr-Mikenas-Carls Variation, Nei Gambit	1. c4 Nf6 2. Nc3 e6 3. e4 c5 4. e5 Ng8
333	A19	English Opening: Mikenas-Carls, Sicilian	1. c4 Nf6 2. Nc3 e6 3. e4 c5
334	A20	English Opening: Drill Variation	1. c4 e5 2. g3 h5
335	A20	English Opening: King's English Variation	1. c4 e5
336	A20	English Opening: King's English Variation, Kahiko-Hula Gambit	1. c4 e5 2. e3 Nf6 3. f4 exf4 4. Nf3
337	A20	English Opening: King's English Variation, Nimzowitsch Variation	1. c4 e5 2. Nf3
338	A20	English Opening: King's English Variation, Nimzowitsch-Flohr Variation	1. c4 e5 2. Nf3 e4
339	A21	English Opening: King's English Variation	1. c4 e5 2. Nc3 d6 3. Nf3
340	A21	English Opening: King's English Variation, Keres Defense	1. c4 e5 2. Nc3 d6 3. g3 c6
341	A21	English Opening: King's English Variation, Kramnik-Shirov Counterattack	1. c4 e5 2. Nc3 Bb4
342	A21	English Opening: King's English Variation, Reversed Sicilian	1. c4 e5 2. Nc3
343	A21	English Opening: King's English Variation, Smyslov Defense	1. c4 e5 2. Nc3 d6 3. Nf3 Bg4
344	A21	English Opening: King's English Variation, Troger Defense	1. c4 e5 2. Nc3 Nc6 3. g3 d6 4. Bg2 Be6
345	A22	English Opening: Carls-Bremen System	1. c4 e5 2. Nc3 Nf6 3. g3
346	A22	English Opening: King's English Variation, Bellon Gambit	1. c4 e5 2. Nc3 Nf6 3. Nf3 e4 4. Ng5 b5
347	A22	English Opening: King's English Variation, Two Knights Variation	1. c4 e5 2. Nc3 Nf6
348	A22	English Opening: King's English Variation, Two Knights Variation, Reversed Dragon	1. c4 e5 2. Nc3 Nf6 3. g3 d5
349	A22	English Opening: King's English Variation, Two Knights Variation, Smyslov System	1. c4 e5 2. Nc3 Nf6 3. g3 Bb4
350	A22	English Opening: King's English, Erbenheimer Gambit	1. c4 e5 2. Nc3 Nf6 3. Nf3 e4 4. Ng5 Ng4
351	A22	English Opening: King's English, Mazedonisch	1. c4 e5 2. Nc3 Nf6 3. f4
352	A23	English Opening: King's English Variation, Two Knights Variation, Keres Variation	1. c4 e5 2. Nc3 Nf6 3. g3 c6
353	A24	English Opening: King's English Variation, Two Knights Variation, Fianchetto Line	1. c4 e5 2. Nc3 Nf6 3. g3 g6
354	A25	English Opening: Closed, Taimanov Variation	1. c4 e5 2. Nc3 Nc6 3. g3 g6 4. Rb1 Nh6 5. Bg2 Bg7
355	A25	English Opening: Closed, Taimanov Variation	1. c4 e5 2. Nc3 Nc6 3. g3 g6 4. Bg2 Bg7 5. e3 d6 6. Nge2 Nh6
356	A25	English Opening: King's English Variation, Bremen-Hort Variation	1. c4 e5 2. Nc3 Nc6 3. g3 g6 4. Bg2 Bg7 5. e3 d6 6. Nge2 Be6
