Index	eco	name	pgn
948	B07	Pirc Defense: Chinese Variation	1. e4 d6 2. d4 Nf6 3. Nc3 g6 4. Be2 Bg7 5. g4
949	B07	Pirc Defense: Kholmov System	1. e4 d6 2. d4 Nf6 3. Nc3 g6 4. Bc4
950	B07	Pirc Defense: Sveshnikov System	1. e4 d6 2. d4 Nf6 3. Nc3 g6 4. g3
951	B08	Pirc Defense: Classical Variation	1. e4 d6 2. d4 Nf6 3. Nc3 g6 4. Nf3
952	B08	Pirc Defense: Classical Variation	1. e4 d6 2. d4 Nf6 3. Nc3 g6 4. Nf3 Bg7
953	B08	Pirc Defense: Classical Variation, Quiet System	1. e4 d6 2. d4 Nf6 3. Nc3 g6 4. Nf3 Bg7 5. Be2
954	B08	Pirc Defense: Classical Variation, Quiet System, Chigorin Line	1. e4 d6 2. d4 Nf6 3. Nc3 g6 4. Nf3 Bg7 5. Be2 O-O 6. O-O Nc6
955	B08	Pirc Defense: Classical Variation, Quiet System, Czech Defense	1. e4 d6 2. d4 Nf6 3. Nc3 g6 4. Nf3 Bg7 5. Be2 O-O 6. O-O c6
956	B08	Pirc Defense: Classical Variation, Quiet System, Parma Defense	1. e4 d6 2. d4 Nf6 3. Nc3 g6 4. Nf3 Bg7 5. Be2 O-O 6. O-O Bg4
957	B08	Pirc Defense: Classical Variation, Schlechter Variation	1. e4 d6 2. d4 Nf6 3. Nc3 g6 4. Nf3 Bg7 5. h3
958	B09	Pirc Defense: Austrian Attack	1. e4 d6 2. d4 Nf6 3. Nc3 g6 4. f4
959	B09	Pirc Defense: Austrian Attack	1. e4 d6 2. d4 Nf6 3. Nc3 g6 4. f4 Bg7 5. Nf3 O-O
960	B09	Pirc Defense: Austrian Attack, Dragon Formation	1. e4 d6 2. d4 Nf6 3. Nc3 g6 4. f4 Bg7 5. Nf3 c5
961	B09	Pirc Defense: Austrian Attack, Kurajica Variation	1. e4 d6 2. d4 Nf6 3. Nc3 g6 4. f4 Bg7 5. Nf3 O-O 6. Be3
962	B09	Pirc Defense: Austrian Attack, Ljubojevic Variation	1. e4 d6 2. d4 Nf6 3. Nc3 g6 4. f4 Bg7 5. Bc4
963	B09	Pirc Defense: Austrian Attack, Unzicker Attack	1. e4 d6 2. d4 Nf6 3. Nc3 g6 4. f4 Bg7 5. Nf3 O-O 6. e5
964	B09	Pirc Defense: Austrian Attack, Unzicker Attack, Bronstein Variation	1. e4 d6 2. d4 Nf6 3. Nc3 g6 4. f4 Bg7 5. Nf3 O-O 6. e5 Nfd7 7. h4
965	B09	Pirc Defense: Austrian Attack, Weiss Variation	1. e4 d6 2. d4 Nf6 3. Nc3 g6 4. f4 Bg7 5. Nf3 O-O 6. Bd3
966	B10	Caro-Kann Defense	1. e4 c6
967	B10	Caro-Kann Defense	1. e4 c6 2. Nc3
968	B10	Caro-Kann Defense	1. e4 c6 2. Nc3 d5
969	B10	Caro-Kann Defense: Accelerated Panov Attack	1. e4 c6 2. c4
970	B10	Caro-Kann Defense: Accelerated Panov Attack	1. e4 c6 2. c4 d5
971	B10	Caro-Kann Defense: Accelerated Panov Attack, Modern Variation	1. e4 c6 2. c4 d5 3. exd5 cxd5 4. cxd5 Nf6
972	B10	Caro-Kann Defense: Accelerated Panov Attack, Open Variation	1. e4 c6 2. c4 e5
973	B10	Caro-Kann Defense: Accelerated Panov Attack, Pseudo-Scandinavian	1. e4 c6 2. c4 d5 3. exd5 Qxd5
974	B10	Caro-Kann Defense: Accelerated Panov Attack, Van Weersel Attack	1. e4 c6 2. c4 d5 3. cxd5 cxd5 4. Qb3
975	B10	Caro-Kann Defense: Apocalypse Attack	1. e4 c6 2. Nf3 d5 3. exd5 cxd5 4. Ne5
976	B10	Caro-Kann Defense: Breyer Variation	1. e4 c6 2. d3
977	B10	Caro-Kann Defense: Breyer Variation, Stein Attack	1. e4 c6 2. d3 d5 3. Nd2 g6 4. Ngf3 Bg7 5. g3 e5 6. Bg2 Ne7 7. O-O O-O 8. b4
978	B10	Caro-Kann Defense: Euwe Attack	1. e4 c6 2. b3
979	B10	Caro-Kann Defense: Goldman Variation	1. e4 c6 2. Nc3 d5 3. Qf3
980	B10	Caro-Kann Defense: Hector Gambit	1. e4 c6 2. Nc3 d5 3. Nf3 dxe4 4. Ng5
981	B10	Caro-Kann Defense: Hillbilly Attack	1. e4 c6 2. Bc4
982	B10	Caro-Kann Defense: Hillbilly Attack, Schaeffer Gambit	1. e4 c6 2. Bc4 d5 3. Bb3 dxe4 4. Qh5
983	B10	Caro-Kann Defense: Labahn Attack	1. e4 c6 2. b4
984	B10	Caro-Kann Defense: Labahn Attack, Double Gambit	1. e4 c6 2. b4 d5 3. b5
985	B10	Caro-Kann Defense: Labahn Attack, Polish Variation	1. e4 c6 2. b4 e5 3. Bb2
986	B10	Caro-Kann Defense: Scorpion-Horus Gambit	1. e4 c6 2. Nc3 d5 3. d3 dxe4 4. Bg5
987	B10	Caro-Kann Defense: Spike Variation	1. e4 c6 2. g4
988	B10	Caro-Kann Defense: Spike Variation, Scorpion-Grob Gambit	1. e4 c6 2. g4 d5 3. Nc3 dxe4 4. d3
989	B10	Caro-Kann Defense: Toikkanen Gambit	1. e4 c6 2. c4 d5 3. e5
990	B10	Caro-Kann Defense: Two Knights Attack	1. e4 c6 2. Nc3 d5 3. Nf3
991	B11	Caro-Kann Defense: Two Knights Attack, Mindeno Variation	1. e4 c6 2. Nc3 d5 3. Nf3 Bg4
992	B11	Caro-Kann Defense: Two Knights Attack, Mindeno Variation, Exchange Line	1. e4 c6 2. Nc3 d5 3. Nf3 Bg4 4. h3 Bxf3
993	B11	Caro-Kann Defense: Two Knights Attack, Mindeno Variation, Retreat Line	1. e4 c6 2. Nc3 d5 3. Nf3 Bg4 4. h3 Bh5
994	B12	Caro-Kann Defense	1. e4 c6 2. d4
995	B12	Caro-Kann Defense	1. e4 c6 2. d4 d5
996	B12	Caro-Kann Defense: Advance Variation	1. e4 c6 2. d4 d5 3. e5
997	B12	Caro-Kann Defense: Advance Variation, Bayonet Attack	1. e4 c6 2. d4 d5 3. e5 Bf5 4. g4
998	B12	Caro-Kann Defense: Advance Variation, Botvinnik-Carls Defense	1. e4 c6 2. d4 d5 3. e5 c5
999	B12	Caro-Kann Defense: Advance Variation, Bronstein Variation	1. e4 c6 2. d4 d5 3. e5 Bf5 4. Ne2
1000	B12	Caro-Kann Defense: Advance Variation, Prins Attack	1. e4 c6 2. d4 d5 3. e5 Bf5 4. b4
1001	B12	Caro-Kann Defense: Advance Variation, Short Variation	1. e4 c6 2. d4 d5 3. e5 Bf5 4. Nf3
1002	B12	Caro-Kann Defense: Advance Variation, Tal Variation	1. e4 c6 2. d4 d5 3. e5 Bf5 4. h4
1003	B12	Caro-Kann Defense: Advance Variation, Van der Wiel Attack	1. e4 c6 2. d4 d5 3. e5 Bf5 4. Nc3
1004	B12	Caro-Kann Defense: Advance Variation, Van der Wiel Attack	1. e4 c6 2. d4 d5 3. e5 Bf5 4. Nc3 e6 5. g4 Bg6 6. Nge2 c5 7. h4
1005	B12	Caro-Kann Defense: Advance Variation, Van der Wiel Attack, Dreyev Defense	1. e4 c6 2. d4 d5 3. e5 Bf5 4. Nc3 Qb6
1006	B12	Caro-Kann Defense: Advance, Short Variation	1. e4 c6 2. d4 d5 3. e5 Bf5 4. c3 e6 5. Be2
1007	B12	Caro-Kann Defense: De Bruycker Defense	1. e4 c6 2. d4 Na6
1008	B12	Caro-Kann Defense: De Bruycker Defense	1. e4 c6 2. d4 Na6 3. Nc3 Nc7
1009	B12	Caro-Kann Defense: Edinburgh Variation	1. e4 c6 2. d4 d5 3. Nd2 Qb6
1010	B12	Caro-Kann Defense: Maróczy Variation	1. e4 c6 2. d4 d5 3. f3
1011	B12	Caro-Kann Defense: Maróczy Variation, Maróczy Gambit	1. e4 c6 2. d4 d5 3. f3 dxe4 4. fxe4 e5 5. Nf3 exd4 6. Bc4
1012	B12	Caro-Kann Defense: Masi Variation	1. e4 c6 2. d4 Nf6
1013	B12	Caro-Kann Defense: Massachusetts Defense	1. e4 c6 2. d4 f5
1014	B12	Caro-Kann Defense: Mieses Attack, Landau Gambit	1. e4 c6 2. d4 d5 3. Bd3 Nf6 4. e5 Nfd7 5. e6
1015	B12	Caro-Kann Defense: Mieses Gambit	1. e4 c6 2. d4 d5 3. Be3
1016	B12	Caro-Kann Defense: Modern Variation	1. e4 c6 2. d4 d5 3. Nd2
1017	B12	Caro-Kann Defense: Ulysses Gambit	1. e4 c6 2. d4 d5 3. Nf3 dxe4 4. Ng5
1018	B13	Caro-Kann Defense: Exchange Variation	1. e4 c6 2. d4 d5 3. exd5
1019	B13	Caro-Kann Defense: Exchange Variation, Bulla Attack	1. e4 c6 2. d4 d5 3. exd5 cxd5 4. g4
1020	B13	Caro-Kann Defense: Exchange Variation, Rubinstein Variation	1. e4 c6 2. d4 d5 3. exd5 cxd5 4. Bd3 Nc6 5. c3 Nf6 6. Bf4
1021	B13	Caro-Kann Defense: Panov Attack	1. e4 c6 2. d4 d5 3. exd5 cxd5 4. c4
1022	B13	Caro-Kann Defense: Panov Attack	1. e4 c6 2. d4 d5 3. exd5 cxd5 4. c4 Nf6 5. Nc3
1023	B13	Caro-Kann Defense: Panov Attack, Gunderam Attack	1. e4 c6 2. d4 d5 3. exd5 cxd5 4. c4 Nf6 5. c5
1024	B13	Caro-Kann Defense: Panov Attack, Modern Defense	1. e4 c6 2. d4 d5 3. exd5 cxd5 4. c4 Nf6 5. Nc3 Nc6
1025	B13	Caro-Kann Defense: Panov Attack, Modern Defense, Carlsbad Line	1. e4 c6 2. d4 d5 3. exd5 cxd5 4. c4 Nf6 5. Nc3 Nc6 6. Bg5 e6
1026	B13	Caro-Kann Defense: Panov Attack, Modern Defense, Czerniak Line	1. e4 c6 2. d4 d5 3. exd5 cxd5 4. c4 Nf6 5. Nc3 Nc6 6. Bg5 Qa5
1027	B13	Caro-Kann Defense: Panov Attack, Modern Defense, Mieses Line	1. e4 c6 2. d4 d5 3. exd5 cxd5 4. c4 Nf6 5. Nc3 Nc6 6. Nf3 Bg4
1028	B13	Caro-Kann Defense: Panov Attack, Modern Defense, Reifir-Spielmann Line	1. e4 c6 2. d4 d5 3. exd5 cxd5 4. c4 Nf6 5. Nc3 Nc6 6. Bg5 Qb6
1029	B13	Caro-Kann Defense: Panov-Botvinnik, Herzog Defense	1. e4 c6 2. d4 d5 3. exd5 cxd5 4. c4 Nf6 5. Nc3 Nc6 6. Bg5 dxc4 7. d5 Na5
1030	B14	Caro-Kann Defense: Panov Attack	1. e4 c6 2. d4 d5 3. exd5 cxd5 4. c4 Nf6 5. Nc3 e6
1031	B14	Caro-Kann Defense: Panov Attack, Fianchetto Defense	1. e4 c6 2. d4 d5 3. exd5 cxd5 4. c4 Nf6 5. Nc3 g6
1032	B14	Caro-Kann Defense: Panov Attack, Fianchetto Defense, Fianchetto Gambit	1. e4 c6 2. d4 d5 3. exd5 cxd5 4. c4 Nf6 5. Nc3 g6 6. cxd5 Bg7
1033	B14	Caro-Kann Defense: Panov Attack, Main Line	1. e4 c6 2. d4 d5 3. exd5 cxd5 4. c4 Nf6 5. Nc3 e6 6. Nf3 Bb4
1034	B15	Caro-Kann Defense	1. e4 c6 2. d4 d5 3. Nc3
1035	B15	Caro-Kann Defense	1. e4 c6 2. d4 d5 3. Nc3 dxe4
1036	B15	Caro-Kann Defense: Alekhine Gambit	1. e4 c6 2. d4 d5 3. Nc3 dxe4 4. Nxe4 Nf6 5. Bd3
1037	B15	Caro-Kann Defense: Campomanes Attack	1. e4 c6 2. d4 d5 3. Nc3 Nf6
1038	B15	Caro-Kann Defense: Forgacs Variation	1. e4 c6 2. d4 d5 3. Nc3 dxe4 4. Nxe4 Nf6 5. Nxf6+ exf6 6. Bc4
1039	B15	Caro-Kann Defense: Gurgenidze Counterattack	1. e4 c6 2. d4 d5 3. Nc3 b5
1040	B15	Caro-Kann Defense: Gurgenidze System	1. e4 c6 2. d4 d5 3. Nc3 g6
1041	B15	Caro-Kann Defense: Main Line	1. e4 c6 2. d4 d5 3. Nd2 dxe4 4. Nxe4
1042	B15	Caro-Kann Defense: Rasa-Studier Gambit	1. e4 c6 2. d4 d5 3. Nc3 dxe4 4. f3
1043	B15	Caro-Kann Defense: Tartakower Variation	1. e4 c6 2. d4 d5 3. Nc3 dxe4 4. Nxe4 Nf6 5. Nxf6+ exf6
1044	B15	Caro-Kann Defense: von Hennig Gambit	1. e4 c6 2. d4 d5 3. Nc3 dxe4 4. Bc4
1045	B16	Caro-Kann Defense: Bronstein-Larsen Variation	1. e4 c6 2. d4 d5 3. Nc3 dxe4 4. Nxe4 Nf6 5. Nxf6+ gxf6
1046	B16	Caro-Kann Defense: Finnish Variation	1. e4 c6 2. d4 d5 3. Nd2 dxe4 4. Nxe4 h6
1047	B17	Caro-Kann Defense: Karpov Variation	1. e4 c6 2. d4 d5 3. Nd2 dxe4 4. Nxe4 Nd7
1048	B17	Caro-Kann Defense: Karpov Variation, Modern Main Line	1. e4 c6 2. d4 d5 3. Nd2 dxe4 4. Nxe4 Nd7 5. Ng5 Ngf6 6. Bd3 e6 7. N1f3 Bd6 8. Qe2 h6 9. Ne4 Nxe4 10. Qxe4
1049	B17	Caro-Kann Defense: Karpov Variation, Modern Variation	1. e4 c6 2. d4 d5 3. Nd2 dxe4 4. Nxe4 Nd7 5. Ng5
1050	B17	Caro-Kann Defense: Karpov Variation, Modern Variation, Ivanchuk Defense	1. e4 c6 2. d4 d5 3. Nd2 dxe4 4. Nxe4 Nd7 5. Ng5 Ndf6
1051	B17	Caro-Kann Defense: Karpov Variation, Modern Variation, Kasparov Attack	1. e4 c6 2. d4 d5 3. Nc3 dxe4 4. Nxe4 Nd7 5. Nf3 Ngf6 6. Ng3
1052	B17	Caro-Kann Defense: Karpov Variation, Smyslov Variation	1. e4 c6 2. d4 d5 3. Nd2 dxe4 4. Nxe4 Nd7 5. Bc4 Ngf6 6. Ng5 e6 7. Qe2 Nb6
1053	B17	Caro-Kann Defense: Karpov Variation, Smyslov Variation, Main Line	1. e4 c6 2. d4 d5 3. Nd2 dxe4 4. Nxe4 Nd7 5. Bc4 Ngf6 6. Ng5 e6 7. Qe2 Nb6 8. Bb3
1054	B17	Caro-Kann Defense: Karpov Variation, Tiviakov-Fischer Attack	1. e4 c6 2. d4 d5 3. Nd2 dxe4 4. Nxe4 Nd7 5. Bc4 Ngf6 6. Nxf6+ Nxf6
1055	B18	Caro-Kann Defense: Classical Variation	1. e4 c6 2. d4 d5 3. Nd2 dxe4 4. Nxe4 Bf5
1056	B18	Caro-Kann Defense: Classical Variation, Flohr Variation	1. e4 c6 2. d4 d5 3. Nd2 dxe4 4. Nxe4 Bf5 5. Ng3 Bg6 6. Nh3
1057	B18	Caro-Kann Defense: Classical Variation, Main Line	1. e4 c6 2. d4 d5 3. Nd2 dxe4 4. Nxe4 Bf5 5. Ng3 Bg6 6. h4
1058	B18	Caro-Kann Defense: Classical Variation, Maróczy Attack	1. e4 c6 2. d4 d5 3. Nd2 dxe4 4. Nxe4 Bf5 5. Ng3 Bg6 6. f4
1059	B19	Caro-Kann Defense: Classical Variation	1. e4 c6 2. d4 d5 3. Nd2 dxe4 4. Nxe4 Bf5 5. Ng3 Bg6 6. h4 h6 7. Nf3 Nd7
1060	B19	Caro-Kann Defense: Classical Variation, Lobron System	1. e4 c6 2. d4 d5 3. Nd2 dxe4 4. Nxe4 Bf5 5. Ng3 Bg6 6. h4 h6 7. Nf3 Nd7 8. h5 Bh7 9. Bd3 Bxd3 10. Qxd3 e6 11. Bd2 Ngf6 12. O-O-O Be7
1061	B19	Caro-Kann Defense: Classical Variation, Seirawan Variation	1. e4 c6 2. d4 d5 3. Nd2 dxe4 4. Nxe4 Bf5 5. Ng3 Bg6 6. h4 h6 7. Nf3 Nd7 8. h5 Bh7 9. Bd3 Bxd3 10. Qxd3 Ngf6 11. Bd2 e6 12. O-O-O Bd6
1062	B19	Caro-Kann Defense: Classical Variation, Spassky Variation	1. e4 c6 2. d4 d5 3. Nd2 dxe4 4. Nxe4 Bf5 5. Ng3 Bg6 6. h4 h6 7. Nf3 Nd7 8. h5
1063	B20	Sicilian Defense	1. e4 c5
1064	B20	Sicilian Defense: Amazon Attack	1. e4 c5 2. Qg4
1065	B20	Sicilian Defense: Big Clamp Formation	1. e4 c5 2. d3 Nc6 3. c3 d6 4. f4
1066	B20	Sicilian Defense: Bowdler Attack	1. e4 c5 2. Bc4
1067	B20	Sicilian Defense: Brick Variation	1. e4 c5 2. Nh3
1068	B20	Sicilian Defense: Euwe Attack, Prins Gambit	1. e4 c5 2. b3 d5 3. Bb2
1069	B20	Sicilian Defense: Gloria Variation	1. e4 c5 2. c4 d6 3. Nc3 Nc6 4. g3 h5
1070	B20	Sicilian Defense: Grob Variation	1. e4 c5 2. g4
1071	B20	Sicilian Defense: Keres Variation	1. e4 c5 2. Ne2
1072	B20	Sicilian Defense: King David's Opening	1. e4 c5 2. Ke2
1073	B20	Sicilian Defense: Kronberger Variation	1. e4 c5 2. Na3
1074	B20	Sicilian Defense: Kronberger Variation, Nemeth Gambit	1. e4 c5 2. Na3 Nc6 3. d4 cxd4 4. Bc4
1075	B20	Sicilian Defense: Lasker-Dunne Attack	1. e4 c5 2. g3
1076	B20	Sicilian Defense: Mengarini Variation	1. e4 c5 2. a3
1077	B20	Sicilian Defense: Myers Attack, with a4	1. e4 c5 2. a4
1078	B20	Sicilian Defense: Myers Attack, with h4	1. e4 c5 2. h4
1079	B20	Sicilian Defense: Snyder Variation	1. e4 c5 2. b3
1080	B20	Sicilian Defense: Snyder Variation, Queen Fianchetto Variation	1. e4 c5 2. b3 b6
1081	B20	Sicilian Defense: Staunton-Cochrane Variation	1. e4 c5 2. c4
1082	B20	Sicilian Defense: Wing Gambit	1. e4 c5 2. b4
1083	B20	Sicilian Defense: Wing Gambit, Abrahams Variation	1. e4 c5 2. b4 cxb4 3. Bb2
1084	B20	Sicilian Defense: Wing Gambit, Carlsbad Variation	1. e4 c5 2. b4 cxb4 3. a3 bxa3
1085	B20	Sicilian Defense: Wing Gambit, Marienbad Variation	1. e4 c5 2. b4 cxb4 3. a3 d5 4. exd5 Qxd5 5. Bb2
1086	B20	Sicilian Defense: Wing Gambit, Marshall Variation	1. e4 c5 2. b4 cxb4 3. a3
1087	B20	Sicilian Defense: Wing Gambit, Nanu Gambit	1. e4 c5 2. b4 cxb4 3. a3 d5 4. exd5 Qxd5 5. Nf3 e5 6. c4 Qe6 7. Bd3
1088	B20	Sicilian Defense: Wing Gambit, Romanian Defense	1. e4 c5 2. b4 cxb4 3. a3 d5 4. exd5 Qxd5 5. Nf3 e5 6. Bb2 Nc6 7. c4 Qe6
1089	B20	Sicilian Defense: Wing Gambit, Santasiere Variation	1. e4 c5 2. b4 cxb4 3. c4
1090	B21	Bird Opening: Dutch Variation, Batavo Gambit	1. e4 c5 2. f4 d5 3. Nf3 dxe4
1091	B21	Sicilian Defense: Coles Sicilian Gambit	1. e4 c5 2. d4 cxd4 3. Qxd4 Nc6 4. Qd1 Nf6 5. Bc4
1092	B21	Sicilian Defense: Halasz Gambit	1. e4 c5 2. d4 cxd4 3. f4
1093	B21	Sicilian Defense: McDonnell Attack	1. e4 c5 2. f4
1094	B21	Sicilian Defense: McDonnell Attack, Tal Gambit	1. e4 c5 2. f4 d5 3. exd5 Nf6
1095	B21	Sicilian Defense: Morphy Gambit	1. e4 c5 2. d4 cxd4 3. Nf3
1096	B21	Sicilian Defense: Morphy Gambit, Andreaschek Gambit	1. e4 c5 2. d4 cxd4 3. Nf3 e5 4. c3
1097	B21	Sicilian Defense: Smith-Morra Gambit	1. e4 c5 2. d4
1098	B21	Sicilian Defense: Smith-Morra Gambit	1. e4 c5 2. d4 cxd4 3. c3
1099	B21	Sicilian Defense: Smith-Morra Gambit Accepted, Chicago Defense	1. e4 c5 2. d4 cxd4 3. c3 dxc3 4. Nxc3 d6 5. Nf3 e6 6. Bc4 Nf6 7. O-O a6
1100	B21	Sicilian Defense: Smith-Morra Gambit Accepted, Classical Formation	1. e4 c5 2. d4 cxd4 3. c3 dxc3 4. Nxc3 Nc6 5. Nf3 d6 6. Bc4 a6 7. O-O Nf6
1101	B21	Sicilian Defense: Smith-Morra Gambit Accepted, Fianchetto Defense	1. e4 c5 2. d4 cxd4 3. c3 dxc3 4. Nxc3 Nc6 5. Nf3 g6
1102	B21	Sicilian Defense: Smith-Morra Gambit Accepted, Finegold Defense	1. e4 c5 2. d4 cxd4 3. c3 dxc3 4. Nxc3 e6 5. Nf3 d6 6. Bc4 a6 7. O-O Be7 8. Qe2 Nf6
1103	B21	Sicilian Defense: Smith-Morra Gambit Accepted, Kan Formation	1. e4 c5 2. d4 cxd4 3. c3 dxc3 4. Nxc3 e6 5. Nf3 a6
1104	B21	Sicilian Defense: Smith-Morra Gambit Accepted, Larsen Defense	1. e4 c5 2. d4 cxd4 3. c3 dxc3 4. Nxc3 Nc6 5. Nf3 e6 6. Bc4 Qc7 7. Qe2 a6 8. O-O Bd6
1105	B21	Sicilian Defense: Smith-Morra Gambit Accepted, Morphy Defense	1. e4 c5 2. d4 cxd4 3. c3 dxc3 4. Nxc3 Nc6 5. Nf3 e6 6. Bc4 Bc5
1106	B21	Sicilian Defense: Smith-Morra Gambit Accepted, Morphy Defense Deferred	1. e4 c5 2. d4 cxd4 3. c3 dxc3 4. Nxc3 Nc6 5. Nf3 e6 6. Bc4 a6 7. O-O b5 8. Bb3 Bc5
1107	B21	Sicilian Defense: Smith-Morra Gambit Accepted, Paulsen Formation	1. e4 c5 2. d4 cxd4 3. c3 dxc3 4. Nxc3 Nc6 5. Nf3 e6 6. Bc4 a6
1108	B21	Sicilian Defense: Smith-Morra Gambit Accepted, Pin Defense	1. e4 c5 2. d4 cxd4 3. c3 dxc3 4. Nxc3 Nc6 5. Nf3 e6 6. Bc4 Bb4
1109	B21	Sicilian Defense: Smith-Morra Gambit Accepted, Scheveningen Formation	1. e4 c5 2. d4 cxd4 3. c3 dxc3 4. Nxc3 Nc6 5. Nf3 d6 6. Bc4 e6
1110	B21	Sicilian Defense: Smith-Morra Gambit Accepted, Sozin Formation	1. e4 c5 2. d4 cxd4 3. c3 dxc3 4. Nxc3 Nc6 5. Bc4 e6 6. Nf3 d6 7. O-O a6 8. Qe2 b5
1111	B21	Sicilian Defense: Smith-Morra Gambit Accepted, Taimanov Formation	1. e4 c5 2. d4 cxd4 3. c3 dxc3 4. Nxc3 e6 5. Bc4 a6 6. Nf3 Ne7
1112	B21	Sicilian Defense: Smith-Morra Gambit Declined, Alapin Formation	1. e4 c5 2. d4 cxd4 3. c3 Nf6
1113	B21	Sicilian Defense: Smith-Morra Gambit Declined, Center Formation	1. e4 c5 2. d4 cxd4 3. c3 e5
1114	B21	Sicilian Defense: Smith-Morra Gambit Declined, Dubois Variation	1. e4 c5 2. d4 cxd4 3. c3 d3 4. c4
1115	B21	Sicilian Defense: Smith-Morra Gambit Declined, Push Variation	1. e4 c5 2. d4 cxd4 3. c3 d3
1116	B21	Sicilian Defense: Smith-Morra Gambit Declined, Scandinavian Formation	1. e4 c5 2. d4 cxd4 3. c3 d5
1117	B21	Sicilian Defense: Smith-Morra Gambit Declined, Wing Formation	1. e4 c5 2. d4 cxd4 3. c3 Qa5
1118	B21	Sicilian Defense: Smith-Morra Gambit, Chicago Defense	1. e4 c5 2. d4 cxd4 3. c3 dxc3 4. Nxc3 Nc6 5. Bc4 e6 6. Nf3 d6 7. O-O a6 8. Qe2 b5 9. Bb3 Ra7
1119	B21	Sicilian Defense: Smith-Morra Gambit, Danish Variation	1. e4 c5 2. d4 cxd4 3. c3 dxc3 4. Nf3
1120	B22	Sicilian Defense: Alapin Variation	1. e4 c5 2. c3
1121	B22	Sicilian Defense: Alapin Variation, Barmen Defense	1. e4 c5 2. c3 d5 3. exd5 Qxd5
1122	B22	Sicilian Defense: Alapin Variation, Barmen Defense, Central Exchange	1. e4 c5 2. c3 d5 3. exd5 Qxd5 4. d4 cxd4 5. cxd4 Nc6 6. Nf3 Bg4
1123	B22	Sicilian Defense: Alapin Variation, Barmen Defense, Endgame Variation	1. e4 c5 2. c3 d5 3. exd5 Qxd5 4. d4 cxd4 5. cxd4 Nc6 6. Nf3 Bg4 7. Nc3 Bxf3 8. gxf3 Qxd4 9. Qxd4 Nxd4
1124	B22	Sicilian Defense: Alapin Variation, Barmen Defense, Milner-Barry Attack	1. e4 c5 2. c3 d5 3. exd5 Qxd5 4. d4 Nc6 5. Nf3 cxd4 6. cxd4 e5 7. Nc3 Bb4 8. Be2
1125	B22	Sicilian Defense: Alapin Variation, Barmen Defense, Modern Line	1. e4 c5 2. c3 d5 3. exd5 Qxd5 4. d4 Nf6 5. Nf3 Bg4
1126	B22	Sicilian Defense: Alapin Variation, Smith-Morra Declined	1. e4 c5 2. c3 Nf6 3. e5 Nd5 4. d4 cxd4
1127	B22	Sicilian Defense: Alapin Variation, Stoltz Attack	1. e4 c5 2. c3 Nf6 3. e5 Nd5 4. Nf3 Nc6 5. Bc4 Nb6 6. Bb3
1128	B22	Sicilian Defense: Alapin Variation, Stoltz Attack, Ivanchuk Line	1. e4 c5 2. c3 Nf6 3. e5 Nd5 4. Nf3 Nc6 5. Bc4 Nb6 6. Bb3 c4 7. Bc2 Qc7 8. Qe2 g5
1129	B22	Sicilian Defense: Heidenfeld Variation	1. e4 c5 2. c3 Nf6 3. e5 Nd5 4. Nf3 Nc6 5. Na3
1130	B23	Sicilian Defense: Closed	1. e4 c5 2. Nc3
1131	B23	Sicilian Defense: Closed	1. e4 c5 2. Nc3 e6
1132	B23	Sicilian Defense: Closed	1. e4 c5 2. Nc3 e6 3. g3
1133	B23	Sicilian Defense: Closed, Chameleon Variation	1. e4 c5 2. Nc3 Nc6 3. Nge2
1134	B23	Sicilian Defense: Closed, Grob Attack	1. e4 c5 2. Nc3 Nc6 3. g4
1135	B23	Sicilian Defense: Closed, Korchnoi Defense	1. e4 c5 2. Nc3 e6 3. g3 d5
1136	B23	Sicilian Defense: Closed, Traditional	1. e4 c5 2. Nc3 Nc6
1137	B23	Sicilian Defense: Grand Prix Attack	1. e4 c5 2. Nc3 Nc6 3. f4
1138	B23	Sicilian Defense: Grand Prix Attack, Schofman Variation	1. e4 c5 2. Nc3 Nc6 3. f4 g6 4. Nf3 Bg7 5. Bc4 e6 6. f5
1139	B24	Sicilian Defense: Closed	1. e4 c5 2. Nc3 Nc6 3. g3 g6
1140	B24	Sicilian Defense: Closed	1. e4 c5 2. Nc3 Nc6 3. g3 g6 4. Bg2 Bg7
1141	B24	Sicilian Defense: Closed, Fianchetto Variation	1. e4 c5 2. Nc3 Nc6 3. g3
1142	B24	Sicilian Defense: Closed, Smyslov Variation	1. e4 c5 2. Nc3 Nc6 3. g3 g6 4. Bg2 Bg7 5. d3 e6 6. Be3 Nd4 7. Nce2
1143	B25	Sicilian Defense: Closed	1. e4 c5 2. Nc3 Nc6 3. g3 g6 4. Bg2 Bg7 5. d3 d6
1144	B25	Sicilian Defense: Closed	1. e4 c5 2. Nc3 Nc6 3. g3 g6 4. Bg2 Bg7 5. d3 d6 6. f4
1145	B25	Sicilian Defense: Closed, Botvinnik Defense, Edge Variation	1. e4 c5 2. Nc3 Nc6 3. g3 g6 4. Bg2 Bg7 5. d3 d6 6. f4 e5 7. Nh3 Nge7
1146	B25	Sicilian Defense: Closed, Botvinnik Defense, with Nge2	1. e4 c5 2. Nc3 Nc6 3. g3 g6 4. Bg2 Bg7 5. d3 d6 6. Nge2 e5
1147	B25	Sicilian Defense: Closed, Botvinnik Defense, with f4	1. e4 c5 2. Nc3 Nc6 3. g3 g6 4. Bg2 Bg7 5. d3 d6 6. f4 e5
1148	B26	Sicilian Defense: Closed	1. e4 c5 2. Nc3 Nc6 3. g3 g6 4. Bg2 Bg7 5. d3 d6 6. Be3
1149	B27	Modern Defense: Pterodactyl Variation	1. e4 c5 2. Nf3 g6 3. d4 Bg7 4. Nc3 Qa5
1150	B27	Pterodactyl Defense: Sicilian, Anhanguera	1. e4 c5 2. Nf3 g6 3. d4 Bg7 4. Nc3 Qa5 5. Be3
1151	B27	Pterodactyl Defense: Sicilian, Benoni Gambit	1. e4 c5 2. Nf3 g6 3. d4 Bg7 4. Nc3 Qa5 5. d5
1152	B27	Pterodactyl Defense: Sicilian, Pteranodon	1. e4 c5 2. Nf3 g6 3. d4 Bg7 4. dxc5 Qa5+ 5. Nc3 Bxc3+ 6. bxc3
1153	B27	Pterodactyl Defense: Sicilian, Rhamphorhynchus	1. e4 c5 2. Nf3 g6 3. d4 Bg7 4. dxc5 Qa5+ 5. Nc3
1154	B27	Pterodactyl Defense: Sicilian, Unpin	1. e4 c5 2. Nf3 g6 3. d4 Bg7 4. Nc3 Qa5 5. Bd2
1155	B27	Pterodactyl Defense: Western, Pterodactyl	1. e4 c5 2. Nf3 g6 3. c3 Bg7 4. d4 Qa5
1156	B27	Pterodactyl Defense: Western, Rhamphorhynchus	1. e4 c5 2. Nf3 g6 3. d4 Bg7 4. dxc5 Qa5+
1157	B27	Sicilian Defense	1. e4 c5 2. Nf3
1158	B27	Sicilian Defense: Acton Extension	1. e4 c5 2. Nf3 g6 3. c4 Bh6
1159	B27	Sicilian Defense: Brussels Gambit	1. e4 c5 2. Nf3 f5
1160	B27	Sicilian Defense: Bücker Variation	1. e4 c5 2. Nf3 h6
1161	B27	Sicilian Defense: Double-Dutch Gambit	1. e4 c5 2. Nf3 f5 3. exf5 Nh6
1162	B27	Sicilian Defense: Frederico Variation	1. e4 c5 2. Nf3 g6 3. d4 f5
1163	B27	Sicilian Defense: Hyperaccelerated Dragon	1. e4 c5 2. Nf3 g6
1164	B27	Sicilian Defense: Hyperaccelerated Fianchetto	1. e4 c5 2. Nf3 g6 3. d4
1165	B27	Sicilian Defense: Hyperaccelerated Pterodactyl	1. e4 c5 2. Nf3 g6 3. d4 Bg7
1166	B27	Sicilian Defense: Hyperaccelerated Pterodactyl, Exchange Variation	1. e4 c5 2. Nf3 g6 3. d4 Bg7 4. dxc5 Qa5+ 5. Nc3 Bxc3+ 6. bxc3 Qxc3+
1167	B27	Sicilian Defense: Jalalabad Variation	1. e4 c5 2. Nf3 e5
1168	B27	Sicilian Defense: Katalimov Variation	1. e4 c5 2. Nf3 b6
1169	B27	Sicilian Defense: Mongoose Variation	1. e4 c5 2. Nf3 Qa5
1170	B27	Sicilian Defense: Polish Gambit	1. e4 c5 2. Nf3 b5
1171	B27	Sicilian Defense: Quinteros Variation	1. e4 c5 2. Nf3 Qc7
1172	B28	Sicilian Defense: O'Kelly Variation	1. e4 c5 2. Nf3 a6
1173	B28	Sicilian Defense: O'Kelly Variation, Aronin System	1. e4 c5 2. Nf3 a6 3. Be2
1174	B28	Sicilian Defense: O'Kelly Variation, Kieseritzky System	1. e4 c5 2. Nf3 a6 3. b3
1175	B28	Sicilian Defense: O'Kelly Variation, Maróczy Bind	1. e4 c5 2. Nf3 a6 3. c4
1176	B28	Sicilian Defense: O'Kelly Variation, Maróczy Bind, Paulsen Line	1. e4 c5 2. Nf3 a6 3. c4 e6
1177	B28	Sicilian Defense: O'Kelly Variation, Maróczy Bind, Robatsch Line	1. e4 c5 2. Nf3 a6 3. c4 d6
1178	B28	Sicilian Defense: O'Kelly Variation, Normal System	1. e4 c5 2. Nf3 a6 3. d4
1179	B28	Sicilian Defense: O'Kelly Variation, Normal System, Cortlever Gambit	1. e4 c5 2. Nf3 a6 3. d4 cxd4 4. Bc4
1180	B28	Sicilian Defense: O'Kelly Variation, Normal System, Smith-Morra Line	1. e4 c5 2. Nf3 a6 3. d4 cxd4 4. c3
1181	B28	Sicilian Defense: O'Kelly Variation, Normal System, Taimanov Line	1. e4 c5 2. Nf3 a6 3. d4 cxd4 4. Nxd4 e5
1182	B28	Sicilian Defense: O'Kelly Variation, Normal System, Zagorovsky Line	1. e4 c5 2. Nf3 a6 3. d4 cxd4 4. Qxd4
1183	B28	Sicilian Defense: O'Kelly Variation, Quiet System	1. e4 c5 2. Nf3 a6 3. d3
1184	B28	Sicilian Defense: O'Kelly Variation, Réti System	1. e4 c5 2. Nf3 a6 3. g3
1185	B28	Sicilian Defense: O'Kelly Variation, Venice System	1. e4 c5 2. Nf3 a6 3. c3
1186	B28	Sicilian Defense: O'Kelly Variation, Venice System, Barcza Line	1. e4 c5 2. Nf3 a6 3. c3 Nf6
1187	B28	Sicilian Defense: O'Kelly Variation, Venice System, Gambit Line	1. e4 c5 2. Nf3 a6 3. c3 d5 4. exd5 Nf6
1188	B28	Sicilian Defense: O'Kelly Variation, Venice System, Ljubojevic Line	1. e4 c5 2. Nf3 a6 3. c3 b5
1189	B28	Sicilian Defense: O'Kelly Variation, Venice System, Steiner Line	1. e4 c5 2. Nf3 a6 3. c3 d6
1190	B28	Sicilian Defense: O'Kelly Variation, Wing Gambit	1. e4 c5 2. Nf3 a6 3. b4
1191	B28	Sicilian Defense: O'Kelly Variation, Yerevan System	1. e4 c5 2. Nf3 a6 3. Nc3
1192	B29	Sicilian Defense: Nimzowitsch Variation	1. e4 c5 2. Nf3 Nf6
1193	B29	Sicilian Defense: Nimzowitsch Variation, Advance Variation	1. e4 c5 2. Nf3 Nf6 3. e5
1194	B29	Sicilian Defense: Nimzowitsch Variation, Closed Variation	1. e4 c5 2. Nf3 Nf6 3. Nc3
1195	B29	Sicilian Defense: Nimzowitsch Variation, Exchange Variation	1. e4 c5 2. Nf3 Nf6 3. e5 Nd5 4. Nc3 Nxc3
1196	B29	Sicilian Defense: Nimzowitsch Variation, Main Line	1. e4 c5 2. Nf3 Nf6 3. e5 Nd5 4. Nc3 e6 5. Nxd5 exd5 6. d4 Nc6
1197	B30	Sicilian Defense: Closed, Anti-Sveshnikov Variation, Kharlov-Kramnik Line	1. e4 c5 2. Nf3 Nc6 3. Nc3 e5 4. Bc4 Be7 5. d3 d6 6. Nd2 Bg5
1198	B30	Sicilian Defense: Nyezhmetdinov-Rossolimo Attack	1. e4 c5 2. Nf3 Nc6 3. Bb5
1199	B30	Sicilian Defense: Nyezhmetdinov-Rossolimo Attack, San Francisco Gambit	1. e4 c5 2. Nf3 Nc6 3. Bb5 Na5 4. b4
1200	B30	Sicilian Defense: Old Sicilian	1. e4 c5 2. Nf3 Nc6
1201	B30	Sicilian Defense: Portsmouth Gambit	1. e4 c5 2. Nf3 Nc6 3. b4
1202	B30	Sicilian Defense: Rossolimo Variation, Brooklyn Retreat Defense	1. e4 c5 2. Nf3 Nc6 3. Bb5 Nb8
1203	B31	Sicilian Defense: Nyezhmetdinov-Rossolimo Attack, Fianchetto Variation	1. e4 c5 2. Nf3 Nc6 3. Bb5 g6
1204	B31	Sicilian Defense: Nyezhmetdinov-Rossolimo Attack, Fianchetto Variation, Gufeld Gambit	1. e4 c5 2. Nf3 Nc6 3. Bb5 g6 4. O-O Bg7 5. c3 e5 6. d4
1205	B31	Sicilian Defense: Nyezhmetdinov-Rossolimo Attack, Fianchetto Variation, Lutikov Gambit	1. e4 c5 2. Nf3 Nc6 3. Bb5 g6 4. O-O Bg7 5. c3 Nf6 6. d4
1206	B31	Sicilian Defense: Nyezhmetdinov-Rossolimo Attack, Fianchetto Variation, Totsky Attack	1. e4 c5 2. Nf3 Nc6 3. Bb5 g6 4. O-O Bg7 5. c3 Nf6 6. Qa4
1207	B31	Sicilian Defense: Nyezhmetdinov-Rossolimo Attack, Gurgenidze Variation	1. e4 c5 2. Nf3 Nc6 3. Bb5 g6 4. O-O Bg7 5. Re1 e5 6. b4
1208	B32	Sicilian Defense: Accelerated Dragon	1. e4 c5 2. Nf3 Nc6 3. d4 cxd4 4. Nxd4 g6
1209	B32	Sicilian Defense: Flohr Variation	1. e4 c5 2. Nf3 Nc6 3. d4 cxd4 4. Nxd4 Qc7
1210	B32	Sicilian Defense: Franco-Sicilian Variation	1. e4 c5 2. Nf3 Nc6 3. d4 e6
1211	B32	Sicilian Defense: Godiva Variation	1. e4 c5 2. Nf3 Nc6 3. d4 cxd4 4. Nxd4 Qb6
1212	B32	Sicilian Defense: Kalashnikov Variation	1. e4 c5 2. Nf3 Nc6 3. d4 cxd4 4. Nxd4 e5 5. Nb5 d6
1213	B32	Sicilian Defense: Löwenthal Variation	1. e4 c5 2. Nf3 Nc6 3. d4 cxd4 4. Nxd4 e5
1214	B32	Sicilian Defense: Nimzo-American Variation	1. e4 c5 2. Nf3 Nc6 3. d4 cxd4 4. Nxd4 d5
1215	B32	Sicilian Defense: O'Kelly Variation, Maróczy Bind, Geller Line	1. e4 c5 2. Nf3 Nc6 3. d4 cxd4 4. Nxd4 a6 5. c4 e5
